Code,TITRE,CONTENU,ANA. DIPLOM,DATE
0115/CJ,JURIDICTION ET CONTENTIEUX : CONTRAT DE TRANSPORT DE PRODUITS PETROLIERS N°15/399 DU 21 DECEMBRE 2015 + AVENANT N°17/523 DU 27 OCTOBRE 2017 + CONTRAT DE TRANSPORT N°18/0169 DU 15 FEVRIER 2018 : SONABHY ET SABANE TRANSPORT ET COMMERCE,"TRANSPORT, PRODUIT PETROLIER, SONABHY, SABANE TRANSPORT ET COMMERCE.",(CONTRAT),2015. 2017. 2018.
0116/CJ,CONTRAT DE TRAVAIL ENTRE SONABHY ET NANA OUMAROU DU 11 MAI 2010,"TRAVAIL, SONABHY, NANA OUMAROU, FINANCES.",(CONTRAT),"11. MAI, 2010."
0117,,,,
0117/CJ,CONVENTION D'ASSISTANCE ET DE REPRESENTATION EN,"ASSISTANCE, JUSTICE, SONABHY, AUCKENTHALER FRANCK.",(CONTRAT),"16. OCTOBRE, 2009."
0118/CJ,CONTRAT D'APPROVISIONNEMENT DE PRODUITS PETROLIERS : SONABHY ET ADDAX DU 22 AVRIL 2010,"APPROVISIONNEMENT, VENTE, PRODUIT PETROLIER, SONABHY, ADDAX.",(CONTRAT),"22. AVRIL, 2010."
0119/CJ,CONTRAT DE VENTE DE FUEL OIL : SONABHY ET TRAFIGURA DU 23 AVRIL 2010,"VENTE, FUEL OIL, SONABHY, TRAFIGURA.",(CONTRAT),"23. AVRIL, 2010."
0120/CJ,CONTRAT DE VENTE DE PRODUITS PETROLIERS : SONABHY ET TRAFIGURA DU 22 AVRIL 2010,"VENTE, PRODUIT PETROLIER, SONABHY, TRAFIGURA.",(CONTRAT),"22 AVRIL, 2010."
0121/CJ,CONTRAT DE FOURNITURE DE PRODUITS PETROLIERS : SONABHY ET SOPEK INTERNATIONALE DU 25 MAI 2010,"VENTE, PRODUIT PETROLIER, SOPEK INTERNATIONALE,",,
0122/CJ,AVENANT DE RENOUVELLEMENT BRANCHE RISQUES DIVERS : SONAR ET SONABHY 2010,"ASSURANCE, RISQUE, SONAR, SONABHY.",(CONTRAT),"06. MARS, 2010."
0123/CJ,AVENANT DE RENOUVELLEMENT BRANCHE RISQUES DIVERS : SONAR ET SONABHY 2010,"ASSURANCE, RISQUE, SONAR, SONABHY.",(CONTRAT),"05. MARS, 2010."
0124/CJ,AVENANT DE RENOUVELLEMENT BRANCHE INCENDIE : SONAR ET SONABHY 2010,"ASSURANCE, INCENDIE, SONAR, SONABHY.",(CONTRAT),"05. MARS, 2010."
0125/CJ,JURIDICTION ET CONTENTIEUX : CONTRAT DE FOURNITURE DE PRODUITS PETROLIERS DU 12 AVRIL 2002 + MARCHE N°23 /2011 DU 21 AVRIL 2011 POUR FOURNITURE DE TICKETS DE CARBURANTS + CONTRAT N°15/0020 DU 02 FEVRIER 2015 + CONTRAT N°15/0172 DU 07 AVRIL 2015 + ACCORD TRIPARTITE DE DOMICILIATION DE REGLEMENT DU 30 MARS 2015 + CONTRAT DE VENTE N°16/011 DU 25 JANVIER 2016 + CONTRAT N°22/0038 DU 31 JANVIER 2022 + AVENANT,,,
0126/CJ,JURIDICTION ET CONTENTIEUX : CONTRAT D'APPROVISIONNEMENT EN PRODUITS PETROLIERS DU 13 OCTOBRE 2000 + CONTRAT DE FOURNITURE DU 27 NOVEMBRE 2001 : SONABHY ET TAMOIL BURKINA,"FOURNITURE, APPROVISIONNEMENT, PRODUIT PETROLIER, SONABHY, TAMOIL BURKINA, TAMOIL OVERSEAS LIMITED.",(CONTRAT),13. 2000. 2001.
0127/CJ,JURIDICTION ET CONTENTIEUX : TRANSPORT DE PRODUITS PETROLIERS ; AVENANT N°19/0151 DU 10 MAI 2019 + AVENANT N°20/0072 DU 04 MARS 2020 : SONABHY ET WARREN TRADING AND BUSINESS,"TRANSPORT, SONABHY, WARREN TRADING AND BUSINESS, PRODUIT PETROLIER.","(CONTRAT, AVENANT)",29. 2019-2020.
0128/CJ,CONTRAT DE TRANSPORT DE PRODUITS PETROLIERS : SONABHY ET KABORE AZIZI DU 14 JUIN 2010,"TRANSPORT, PRODUIT PETROLIER, SONABHY, KABORE AZIZI.",(CONTRAT),"14. JUIN, 2010."
0129/CJ,JURIDICTION ET CONTENTIEUX : TRANSPORT DE PRODUITS,"SONABHY, TRANSPORT, PRODUIT PETROLIER, TRAORE MOUSSA.",(CONTRAT),27. 2010.
0130/CJ,CONTRAT DE TRAVAIL A DUREE DETERMINEE POUR,"TRAVAIL, RATTRAPAGE, RECEPTION, SONABHY, KABORE ANTOINE DE PADOU.",(CONTRAT),"21. JUIN, 2010."
0131/CJ,CONTRAT DE TRAVAIL A DUREE DETERMINEE POUR,"TRAVAIL, RATTRAPAGE, RECEPTION, SONABHY, BENON MARCELIN.",(CONTRAT),"21. JUIN, 2010."
0132/CJ,CONTRAT DE TRAVAIL A DUREE DETERMINEE POUR,"TRAVAIL, RECEPTION, RATTRAPAGE, SONABHY, OUEDRAOGO TIPOKO ODETTE.",,
0133/CJ,CONTRAT D'ENTRETIEN DES CLIMATISEURS : SONABHY ET CFAO TECHNOLOGIES DU 27 AVRIL 2010,"ENTRETIEN, SONABHY, CFAO TECHNOLOGIES, CLIMATISEUR.",(CONTRAT),"27. AVRIL, 2010."
0134/CJ,CONTRAT D'ENTRETIEN COMPLET : PHOTOCOPIEUR SHARP AR 250 SERIE 10500015 : SONABHY ET CFAO TECHNOLOGIES DU 11 MARS 2010,"ENTRETIEN, SONABHY, CFAO TECHNOLOGIES, PHOTOCOPIEUR SHARP.",(CONTRAT),"11. MARS, 2010."
0135/CJ,CONTRAT D'ENTRETIEN COMPLET : PHOTOCOPIEUR SHARP AR M 351 USF SERIE 55030338 : SONABHY ET CFAO TECHNOLOGIES DU 11 MARS 2010,"ENTRETIEN, SONABHY, CFAO TECHNOLOGIES, PHOTOCOPIEUR SHARP.",(CONTRAT),"11. MARS, 2010."
0136/CJ,CONTRAT D'ENTRETIEN COMPLET : PHOTOCOPIEUR SHARP AR M 351 USF SERIE 55030318 : SONABHY ET CFAO TECHNOLOGIES DU 11 MARS 2010,"ENTRETIEN, SONABHY, CFAO TECHNOLOGIES, PHOTOCOPIEUR SHARP.",,
0137/CJ,CONTRAT D'ENTRETIEN COMPLET : PHOTOCOPIEUR SHARP SF 2052 SERIE 05600411 : SONABHY ET CFAO TECHNOLOGIES DU 11 MARS 2010,"ENTRETIEN, SONABHY, CFAO TECHNOLOGIES, PHOTOCOPIEUR SHARP.",(CONTRAT),"11. MARS, 2010."
0138/CJ,CONTRAT DE CONTRUCTION DU CENTRE EMPLISSEUR DE BINGO (PARTIE TECHNIQUE) : SONABHY ET FRIEDLANDER 2004,"CENTRE EMPLISSEUR, DEPOT DE BINGO, FRIEDLANDER, SONABHY, GAZ BUTANE.",(CONTRAT),2004.
0139/CJ,CONTRAT DE CONSTRUCTION CENTRE EMPLISSEUR DE BINGO (PARTIE COMMERCIALE) : SONABHY ET FRIEDLANDER 2004,"CENTRE EMPLISSEUR, DEPOT DE BINGO, GAZ BUTANE, SONABHY, FRIEDLANDER.",(CONTRAT),2004.
0140/CJ,CONTRAT DE CONSTRUCTION D'UNE SPHERE GPL DE 4000 M3,"SPHERE, GPL, DEPOT DE BINGO, GAZ BUTANE, SONABHY, FRIEDLANDER.",(CONTRAT),2005.
0141/CJ,CONTRAT DE CONSTRUCTION D'UNE SPHERE GPL (PARTIE TECHNIQUE) : SONABHY ET FRIEDLANDER 2005,"SPHERE, GPL, DEPOT DE BINGO, GAZ BUTANE, SONABHY, FRIEDLANDER",(CONTRAT),2005.
0142/CJ,CONTRAT D'INGENIERIE : EXTENSION DU CENTRE,"INGENIERIE, CENTRE EMPLISSEUR, DEPOT DE BINGO, SONABHY, TOTAL OUTRE MER.",(CONTRAT),2007.
0143/CJ,JURIDICTION ET CONTENTIEUX : CONTRAT DE FOURNITURE DE PRODUITS PETROLIERS DU 03 MARS 2007 : SONABHY ET SINI (SOCIETE D'INTERMEDIATION ET DE NECOCE INTERNATIONAL),"PRODUIT PETROLIER, VENTE, SONABHY, SINI, SOCIETE D'INTERMEDIATION ET DE NEGOCE INTERNATIONAL.",(CONTRAT),"23. MARS, 2007."
0144/CJ,EXTENSION DU CENTRE EMPLISSEUR ET MISE EN CONFORMITE DE LA DEFENSE CONTRE INCENDIE (DCI) DU DEPOT DE BINGO : CONTRAT N°10/2007 SONABHY ET FRIEDLANDER,"CENTRE EMPLISSEUR, DEPOT DE BINGO, DEFENSE CONTRE INCENDIE, SONABHY, FRIEDLANDER, GAZ BUTANE.",(CONTRAT),
0145/CJ,JURIDICTION ET CONTENTIEUX : CONTRAT DE TRANSPORT DE PRODUITS PETROLIERS DU 25 AOUT 2008 + CONTRAT DU 25 JUIN 2010 + CONTRAT N°15/0159 DU 03 AVRIL 2015 + CONTRAT N°18/0174 DU 16 FEVRIER 2018 + CONTRAT N°24/00346 DU 25 JUILLET 2024: SONABHY ET TAPSOBA SAIDOU,"TRANSPORT, PRODUIT PETROLIER, SONABHY, TAPSOBA SAIDOU.",(CONTRAT),"2008. 2010. 2015. 2018, 2024."
0146/CJ,"JURIDICTION ET CONTENTIEUX : CONTRAT DE TRANSPORT DE PRODUITS PETROLIERS DU 25 JUIN 2010 + AVENANT N°13/135 DU 20 NOVEMBRE 2013 + CONTRAT N°18/0118 DU 09 FEVRIER 2018 + CONTRAT N°17/00099 DU 02 FEVRIER 2017 + CONTRAT N°18/0332 DU 09 MARS 2018 + CONTRAT N°18/0906 DU 28 NOVEMBRE 2018 + AVENANT N°22/0285 DU 01 JUIN 2022 + AVENANT N°24/0312 DU 19 JUILLET 2024 : SONABHY ET MAIGA IBRAHIMA, EMIF, (SOTRAMI)","TRANSPORT, PRODUIT PETROLIER, SONABHY, MAIGA IBRAHIMA, SOTRAMI, EMIF.","(CONTRAT, AVENANT)",2010. 2013. 2017. 2018. 2022. 2024.
0147/CJ,CONTRAT DE TRANSPORT DE PRODUITS PETROLIERS DU 27 JUILLET 2010 + AVENANT N°11/015 DU 11 MARS 2011 + CONTRAT N°15/0118 DIU 13 MARS 2015 : SONABHY ET TOUGMA K OLGA CLOTILDE,"TRANSPORT, PRODUIT PETROLIER, SONABHY, TOUGMA K OLGA CLOTILDE, ENTREPRISE NOKA.","(CONTRAT, AVENANT)",2010-2011. 2015.
0148/CJ,CONTRAT DE TRANSPORT DE PRODUITS PETROLIERS : SONABHY ET EGF DU 25 JUIN 2010,"TRANSPORT, PRODUIT PETROLIER, SONABHY, EGF.",(CONTRAT),"25. JUIN, 2010."
0149/CJ,JURIDICTION ET CONTENTIEUX : CONTRAT DE FOURNITURE DE GAZ BUTANE A PARTIR DE TEMA DU 03 AOUT 2010 + AVENANT N°11/026 DU 05 AVRIL 2011 AU CONTRAT DE FOURNITURE DE GAZ BUTANE + CONTRAT DE VENTE N°14/0190 DU 24 DECEMBRE 2014 : SONABHY ET ASPEN PETROLEUM,"APPROVISIONNEMENT, GAZ BUTANE, TEMA, VENTE, PRODUIT PETROLIER, SONABHY, ASPEN PETROLEUM.",(CONTRAT),2010-2011. 2014.
0150/CJ,CONTRAT DE TRAVAIL A DUREE DETERMINEE DU 29 JUILLET 2010 + CONTRAT N°15/3633 DU 19 OCTOBRE 2015 : SONABHY ET COMPAORE ROBERT,"TRAVAIL, SONABHY, RESSOURCE HUMAINE, COMPAORE ROBERT.",(CONTRAT),2010. 2015.
0151/CJ,CONTRAT DE TRAVAIL A DUREE DETERMINEE : SONABHY ET KABORE ASSANE DU 29 JUILLET 2010,"TRAVAIL, SONABHY, RESSOURCE HUMAINE, KABORE ASSANE.",(CONTRAT),"29. JUILLET, 2010."
0152/CJ,CONTRAT DE TRAVAIL A DUREE DETERMINEE : SONABHY ET KABORE LASSANE DU 29 JUILLET 2010,"TRAVAIL, SONABHY, RESSOURCE HUMAINE, KABORE LASSANE.",(CONTRAT),"29. JUILLET, 2010."
0153/CJ,CONTRAT DE TRAVAIL A DUREE DETERMINEE : SONABHY ET KALMOGO BERNARD DU 29 JUILLET 2010,"TRAVAIL, SONABHY, RESSOURCE HUMAINE, KALMOGO BERNARD.",(CONTRAT),"29. JUILLET, 2010."
0154/CJ,CONTRAT DE TRAVAIL A DUREE DETERMINEE : SONABHY ET KALMOGO GUETAMANEGDA DU 29 JUILLET 2010,"TRAVAIL, SONABHY, RESSOURCE HUMAINE, KALMOGO GUETAMANEGDA.",(CONTRAT),"29. JUILLET, 2010."
0155/CJ,CONTRAT DE TRAVAIL A DUREE DETERMINEE : SONABHY ET NIKIEMA MOCTAR DU 29 JUILLET 2010,"TRAVAIL, SONABHY, RESSOURCE HUMAINE, NIKIEMA MOCTAR.",(CONTRAT),"29. JUILLET, 2010."
0156/CJ,CONTRAT DE TRAVAIL A DUREE DETERMINEE : SONABHY ET ZOUNGRANA EDMOND DU 29 JUILLET 2010,"TRAVAIL, SONABHY, RESSOURCE HUMAINE, ZOUNGRANA EDMOND.",(CONTRAT),"29. JUILLET, 2010."
0157/CJ,CONTRATS DE TRANSPORT DE PRODUITS PETROLIERS : SONABHY ET KMS SERVICES DU 06 AOUT 2010,"PRODUIT PETROLIER, SONABHY, TRANSPORT, KMS SERVICES.",(CONTRAT),"06. AOUT, 2010."
0158/CJ,"CONVENTION DE NOVATION : CONTRAT DU 26 AOUT 2010 + AVENANT N°16/0137 DU 04 AVRIL 2016 : SONABHY ET PETROLEUM STORAGE MANAGEMENT LIMITED, ORYX SUPPLY ET STORAGE","NOVATION, PETROLEUM STORAGE MANAGEMENT, ORYX SUPPLY ET STORAGE, SONABHY.","(CONTRAT, AVENANT)","26. AOUT, 2010. 2016."
0159/CJ,PROTOCOLE D'ACCORD TRANSACTIONNEL : SONABHY ET ADDAX DU 09 AOUT 2010,"PRODUIT PETROLIER, ACCORD TRANSACTIONNEL, ADDAX, SONABHY.",(CONTRAT),"09. AOUT, 2010."
0160,,,,
0160/CJ,CONTRAT DE VENTE DE PRODUITS PETROLIERS : SONABHY ET ADDAX DU 13 SEPTEMBRE 2010,"VENTE, PRODUIT PETROLIER, ADDAX, SONABHY.",(CONTRAT),"13. SEPTEMBRE, 2010."
0161/CJ,JURIDICTION ET CONTENTIEUX : TRANSPORT DE PRODUITS PETROLIERS ; CONTRAT N°20/0040 DU 11 FEVRIER 2020 + AVENANT N°22/0588 DU 22 NOVEMBRE 2022 + AVENANT N°23/0391 DU 02 AOUT 2023 + AVENANT N°23/0317 DU 16 JUIN 2023 : SONABHY ET SOFADIS,"PRODUIT PETROLIER, SONABHY, TRANSPORT, SOFADIS.","(CONTRAT, AVENANT)",06. 2020. 2022. 2023.
0162/CJ,CONTRAT DE VENTE DE PRODUITS PETROLIERS DU 06 SEPTEMBRE 2010 + CONTRAT N°11/080 DU 07 DECEMBRE 2011 + AVENANT N°12/0060 DU 15 MAI 2012 + AVENANT N°02/2011 DU 04 FEVRIER 2011 + CONTRAT DE VENTE DE PRODUITS PETROLIERS DU 07 JANVIER 2011 + CONTRAT DE VENTE DE PRODUITS PETROLIERS DU 06 SEPTEMBRE 2010 : SONABHY ET BENIN PETRO,"VENTE, PRODUIT PETROLIER, BENIN PETRO, SONABHY.","(CONTRAT, AVENANT)",2010. 2011. 2012.
0163/CJ,JURIDICTION ET CONTENTIEUX : CONTRAT DE PRESTATION DE SERVICES DE VOYAGES + CONTRAT DE PRESTATION DU 29 NOVEMBRE 2011 : SONABHY ET KEYSIA'S TRAVEL,"PRESTATION DE SERVICE, VOYAGE, KEYSIA'S TRAVEL, SONABHY.",(CONTRAT),2011.
0164/CJ,CONTRAT DE VENTE DE PRODUITS PETROLIERS : SONABHY ET OVLAS DU 06 SEPTEMBRE 2010,"PRODUIT PETROLIER, VENTE, OVLAS, SONABHY.",(CONTRAT),"06. SEPTEMBRE, 2010."
0165/CJ,AVENANT N°1 DU CONTRAT DE VENTE DE FUEL OIL : SONABHY ET TRAFIGURA DU 22 SEPTEMBRE 2010,"PRODUIT PETROLIER, VENTE, FUEL OIL, TRAFIGURA, SONABHY.",(CONTRAT),"22. SEPTEMBRE, 2010."
0166/CJ,CONTRAT DE TRANSPORT DE PRODUITS PETROLIERS DU 13 SEPTEMBRE 2010 + CONTRAT N°15/0246 DU 13 MAI 2015 : SONABHY ET TRAORE ABIBATA,"PRODUIT PETROLIER, TRANSPORT, TRAORE ABIBATA, SONABHY.",(CONTRAT),2010. 2015.
0167/CJ,JURIDICTION ET CONTENTIEUX : CONTRAT DE TRANSPORT DE PRODUITS PETROLIERS DU 13 SEPTEMBRE 2010 + CONTRAT N°15/0034 DU 13 FEVRIER 2015 + CONTRAT N°18/0023 DU 01 FEVRIER 2018 + AVENANT N°18/0903 DU 26 NOVEMBRE 2018 : SONABHY ET OUALI TRANSPORT,"PRODUIT PETROLIER, TRANSPORT, OUALI TRANSPORT, SONABHY.","(CONTRAT, AVENANT)","2010, 2015, 2018."
0168/CJ,JURIDICTION ET CONTENTIEUX : CONTRAT DE TRANSPORT DE PRODUITS PETROLIERS DU 13 SEPTEMBRE 2010 + CONTRAT DE TRANSPORT N°18/0125 DU 09 FEVRIER 2018 + CONTRAT DE TRANSPORT N°18/0125 DU 09 FEVRIER 2018 + AVENANT N°21/0003 DU 13 JANVIER 2021 : SONABHY ET KABORE MOUSTAPHA (EKAMOUF),"PRODUIT PETROLIER, TRANSPORT, KABORE MOUSTAPHA, EKAMOUF, SONABHY.","(CONTRAT, AVENANT)",13. 2010. 2018. 2021.
0169/CJ,CONVENTION DE CONSULTATION ET D'ASSISTANCE JURIDIQUE : SONABHY ET ME INOUSSA ZONGO DU 24 SEPTEMBRE 2010,"ASSISTANCE JURIDIQUE, CONVENTION, CONSULTATION JURIDIQUE, AVOCAT, SONABHY, INOUSSA ZONGO.",(CONTRAT),"24. SEPTEMBRE, 2010."
0170/CJ,JURIDICTION ET CONTENTIEUX : TRANSPORT DE PRODUITS,"TRANSPORT, PRODUIT PETROLIER, SONABHY, SAWADOGO MAROU.",(CONTRAT),2010. 2015. 2022.
0171/CJ,CONVENTION POUR ATTRIBUTION DE DECOUVERT DU 11 OCTOBRE 2010 + CONVENTION DE DECOUVERT N°11/0093 DU 21 DECEMBRE 2011 + CONVENTION D'OUVERTURE DE CREDIT LE 14 AVRIL 2015 + ACTE DE CESSION DE CREANCE DU 13,,,
0172/CJ,LETTRE DE COMMANDE N°06/2010 POUR REMISE EN ETAT D'UN CHARIOT ELEVATEUR : SONABHY ET CECOMA DU 23 FEVRIER 2010,"COMMANDE, CHARIOT ELEVATEUR, SONABHY, CECOMA.",(CONTRAT),"23. FEVRIER, 2010."
0173/CJ,LETTRE DE COMMANDE N°01/2010 POUR FOURNITURE DE,"COMMANDE, CLIMATISEUR, VENTILATEUR, SONABHY, ALLIANCE.",(CONTRAT),"12. FEVRIER, 2010."
0174/CJ,LETTRE DE COMMANDE N°02/2010 POUR ACQUISITION DE,"COMMANDE, MATERIEL DE BUREAU, SONABHY, ADAM'S IMPORT EXPORT.",(CONTRAT),"23. FEVRIER, 2010."
0175/CJ,LETTRE DE COMMANDE N°03/2010 POUR ACQUISITION D'UNE,,,
0176/CJ,LETTRE DE COMMANDE N°05/2010 POUR ACQUISITION DE,"COMMANDE, VACCIN, VAXIGRIP, SONABHY, PHARMACIE BOULMIOUGOU.",(CONTRAT),"09. FEVRIER , 2010."
0177/CJ,LETTRE DE COMMANDE N°07/2010 POUR LOCATION D'UN,"COMMANDE, CHARIOT ELEVATEUR, SONABHY, STD SODIGAZ APC.",(CONTRAT),"16. FEVRIER, 2010."
0178/CJ,LETTRE DE COMMANDE N°08/2010 POUR LE REPAS DE LA PRESENTATION DES VOEUX 2010 : SONABHY ET HOTEL OK INN DU 19 FEVRIER 2010,"COMMANDE, REPAS, VOEUX 2010, SONABHY, HOTEL OK INN.",(CONTRAT),"19. FEVRIER, 2010."
0179/CJ,LETTRE DE COMMANDE N°09/2010 POUR LOCATION D'UN,,,
0180/CJ,LETTRE DE COMMANDE N°11/2010 POUR ABONNEMENT A,"COMMANDE, ABONNEMENT, SIDWAYA, SONABHY, LES EDITIONS SIDWAYA.",(CONTRAT),"27. JUILLET, 2010."
0181/CJ,LETTRE DE COMMANDE N°12/2010 POUR LOCATION D'UN,"COMMANDE, CHARIOT ELEVATEUR, SONABHY, STD SODIGAZ APC.",(CONTRAT),"13. AVRIL, 2010."
0182/CJ,LETTRE DE COMMANDE N°13/2010 POUR INSERTION,"COMMANDE, INSERTION PUBLICITAIRE, SONABHY, MEDIACOM.",(CONTRAT),"04. MAI, 2010."
0183/CJ,LETTRE DE COMMANDE N°14/2010 POUR LIVRAISON DU,,,
2010,,"COMMANDE, MAGAZINE, INFORMATION, SONABHY, HELICE.",(CONTRAT),"24. MAI, 2010."
0184/CJ,LETTRE DE COMMANDE N°15/2010 POUR LOCATION D'UN,,,
2010,,"COMMANDE, CHARIOT ELEVATEUR, SONABHY, STD SODIGAZ APC.",(CONTRAT),"24. MAI, 2010."
0185/CJ,LETTRE DE COMMANDE N°16/2010 POUR LES FRAIS DE,"COMMANDE, FORMATION, GESTION DES MARCHES, SONABHY, CERPAMAD.",(CONTRAT),"24. MAI, 2010."
0186/CJ,LETTRE DE COMMANDE N°17/2010 POUR FRAIS DE FORMATION,"COMMANDE, FORMATION, PRODUIT PETROLIER, SONABHY, SPLENDIDE HOTEL.",(CONTRAT),"27. JUILLET, 2010."
0187/CJ,,,,
0188/CJ,LETTRE DE COMMANDE N°19/2010 POUR HERBERGEMENT DES,"COMMANDE, HEBERGEMENT, RESSOURCE HUMAINE, SONABHY, SPLENDIDE HOTEL.",(CONTRAT),"27. JUILLET, 2010."
0189/CJ,JURIDICTION ET CONTENTIEUX : CONTRAT DE FOURNITURE DE PRODUITS PETROLIERS DU 25 OCTOBRE 2010 + CONTRAT DE PASSAGE N°12/0062 DE 2012 + CONTRAT VENTE N°13/0083 DE 2013 + CONTRAT DE VENTE DE PRODUITS PETROLIERS N°12/079 DU 05 JUILLET 2012 + CONTRAT N° 14/0181 DU 22-12-2014 + CONTRAT N°17/0563 DU 05 DECEMBRE 2017 + CONTRAT DE VENTE N°18/0439 DU 12 AVRIL 2018 + CONTRAT DE VENTE N°21 JUIN 2021 + CONTRAT DE VENTE N°22/0160 DU 15 AVRIL 2022 + CONTRAT DE VENTE N°22/0491 DU 19 SEPTEMBRE 2022 + AVENANT N°23/0020 DU 16 JANVIER 2023 + AVENANT N°23/0039 DU 19 JANVIER 2023 + CONTRAT DE VENTE SPOT N°23/0248 DU 26 AVRIL 2023 + AVENANT N°23/0336 DU 26 JUIN 2023 + AVENANT N°23/0520 DU 29 NOVEMBRE 2023 : SONABHY ET PETRO AFRIQUE,"VENTE, PASSAGE, PRODUIT PETROLIER, SONABHY, PETRO AFRIQUE.","(CONTRAT, AVENANT)",2010. 2012. 2013. 2014. 2017. 2018. 2021. 2022. 2023.
0190/CJ,JURIDICTION ET CONTENTIEUX : CONTRAT DE TRANSPORT DE,,,
0191/CJ,JURIDICTION ET CONTENTIEUX : CONTRAT DE VENTE DE GASOIL DU 28 OCTOBRE 2010 + CONTRAT DE VENTE N°13/124 DU 31 OCTOBRE 2013 + CONTRAT DE VENTE DE GASOIL N°13/085 DU 16 JUILLET 2013 + CONTRAT DE FOURNITURE N°11/081 DU 07 DECEMBRE 2011 + CONTRAT DE VENTE N°16/012 DU 13 JANVIER 2016 + AVENANT N°16/0055 DU 04 MARS 2016 : SONABHY ET GUNVOR,"VENTE, FOURNITURE, GASOIL, SONABHY, GUNVOR.","(CONTRAT, AVENANT)","2010-2011, 2013, 2016."
0192/CJ,CONTRAT OPEN VALUE SOUSCRIPTION : SONABHY ET MICROSOFT DU 29 OCTOBRE 2010,"OPEN VALUE, SONABHY, MICROSOFT, LICENCE.",(CONTRAT),"29. OCTOBRE , 2010."
0193/CJ,JURIDICTION ET CONTENTIEUX : TRANSPORT DE PRODUITS PETROLIERS ; AVENANT N°17/410 DU 07 SEPTEMBRE 2017 + CONTRAT N°18/0036 DU 01 FEVRIER 2018 + AVENANT N°18/0468 DU 27 AVRIL 2018 + AVENANT N°19/0167 DU 07 MAI 2019 : SONABHY ET DIA-HYDRAU,"TRANSPORT, PRODUIT PETROLIER, SONABHY, DIA-HYDRAU.","(CONTRAT, AVENANT)",2017. 2018. 2019.
0194/CJ,CONTRAT DE TRANSPORT DE PRODUITS PETROLIERS : SONABHY ET BARRO SIAKA DU 04 OCTOBRE 2010,"TRANSPORT, PRODUIT PETROLIER, SONABHY, BARRO SIAKA.",(CONTRAT),"04. OCTOBRE, 2010."
0195/CJ,JURIDICTION ET CONTENTIEUX : TRANSPORT DE PRODUITS,"TRANSPORT, SONABHY, PRODUIT PETROLIER, M. FASO PIECES AUTO.","(CONTRAT, AVENANT)",22. 2021. 2023.
0196/CJ,CONVENTION DE CONSULTATION ET D'ASSISTANCE JURIDIQUE (AVENANT N°001/2010) : SONABHY ET ZONGO INOUSSA ME DU 29 OCTOBRE 2010,"AVENANT, CONVENTION, ASSISTANCE JURIDIQUE, SONABHY, ZONGO INOUSSA ME.",(CONTRAT),"29. OCTOBRE, 2010."
0197/CJ,AVENANT AU CONVENTION DE CREDIT : SONABHY ET BICIA / SGBB DU 08 OCTOBRE 2010,"AVENANT, CREDIT, CONVENTION, SONABHY, BICIA, SGBB.",(CONTRAT),"08. OCTOBRE, 2010."
0198/CJ,MARCHE N°02 /2010 POUR L'ACQUISITION ET L'INSTALLATION DE RAYONNAGES MOBILES : SONABHY ET PAGES DU 09 FEVRIER 2010,"MARCHE, RAYONNAGE MOBILE, ARCHIVES, SONABHY, PAGES.",(CONTRAT),"09. FEVRIER, 2010."
0199/CJ,MARCHE N°22/2010 POUR LES FOURNITURES DE BUREAU : SONABHY ET IVALOR INTERNATIONAL DU 02 JUILLET 2010,"MARCHE, FOURNITURE DE BUREAU, SONABHY, IVALOR INTERNATIONAL.",(CONTRAT),"02. JUILLET, 2010."
0200/CJ,MARCHE N°23 /2010 POUR LES FOURNITURES ET,"MARCHE, FOURNITURE INFORMATIQUE, CONSOMMABLE INFORMATIQUE, SONABHY, WILL COM SARL.",(CONTRAT),"20. JUILLET, 2010."
0201/CJ,MARCHE N°24 /2010 POUR LA FOURNITURE DE PAPIER,"MARCHE, PAPIER LISTING, SONABHY, GIB CACI B.",(CONTRAT),"27. JUILLET, 2010."
0202/CJ,MARCHE N°25 /2010 POUR LES FOURNITURES DE PRODUITS D'ENTRETIEN : SONABHY ET ETS OUEDAF DU 02 JUILLET 2010,"MARCHE, PRODUIT D'ENTRETIEN, ACHAT, SONABHY, ETS OUEDAF.",(CONTRAT),"02. JUILLET, 2010."
0203/CJ,MARCHE N°26/2010 POUR LA FOURNITURE DE CAPSULES POUR,"MARCHE, CAPSULE DE ROBINET, CLAPET, SONABHY, SALEM GROUP.",(CONTRAT),"29. JUILLET, 2010."
0204/CJ,MARCHE N°27/2010 POUR LA FOURNITURE DE CINQ FUTS D'EMULSEUR DE MILLE LITRES : SONABHY ET TECHNIFEU DU 29 JUILLET 2010,"MARCHE, FUT D'EMULSEUR, SONABHY, TECHNIFEU.",(CONTRAT),"29. JUILLET, 2010."
0205/CJ,"MARCHE N°28 /2010 POUR LA FOURNITURE DE FILS ET PLOMB PERLE, ROBINETS, PINCES A PLOMBER, BOITE A CLAPET, LOCTITE 242 ET JOINT AUTO-SERREUR : SONABHY ET STEA DU 17 AOUT 2010","MARCHE, FILS, PLOMB PERLE, ROBINET, PINCE A PLOMBER, BOITE A CLAPET, LOCTITE 242, JOINT AUTO-SERREUR, SONABHY, STEA.",(CONTRAT),"17. AOUT, 2010."
0206/CJ,"MARCHE N°29 /2010 POUR LA FOURNITURE DE FLEXIBLES,","MARCHE, FLEXIBLE, CLE TRICOISE, PATE A JAUGER, SONABHY, STEA.",(CONTRAT),"17. AOUT, 2010."
0207/CJ,MARCHE N°30/2010 POUR L'ACQUISITION DE DEUX BUREAUX,"MARCHE, BUREAU AVEC RETOUR, ARMOIRE BASSE, SONABHY, ADAM'S IMPORT EXPORT.",(CONTRAT),"27. JUILLET, 2010."
0208/CJ,MARCHE N°31/2010 POUR LA FOURNITURE DE PAPIER,"MARCHE, PAPIER LISTING, SONABHY, IMPRIMERIE DE L'AVENIR.",(CONTRAT),"16. JUILLET, 2010."
0209/CJ,MARCHE N°32/2010 POUR LA FORMATION DES REPRESENTANTS,"MARCHE, FORMATION, DELEGUE DU PERSONNEL, SONABHY, IGEMA AFRIQUE.",(CONTRAT),"16. JUILLET , 2010."
0210/CJ,MARCHE N°33/2010 POUR LA LOCATION D'UN CHARIOT,"MARCHE, CHARIOT ELEVATEUR, LOCATION, SONABHY, STD SODIGAZ APC.",(CONTRAT),"06. AOUT, 2010."
0211/CJ,MARCHE N°34/2010 POUR INSERTION D'UNE PAGE QUADRI DANS L'OPERATEUR DU FASO : SONABHY ET ORION EDITION DU 09 SEPTEMBRE 2010,"MARCHE, INSERTION, PAGE QUADRI, SONABHY, OPERATEUR DU FASO, ORION EDITION.",(CONTRAT),"09. SEPTEMBRE, 2010."
0212/CJ,MARCHE N°35/2010 POUR L'ACQUISITION DE 14 VOITURES,"MARCHE, VEHICULE, SONABHY, DIACFA AUTOMOBILE.",(CONTRAT),"01. SEPTEMBRE, 2010."
0213/CJ,MARCHE N°36/2010 POUR L'ACQUISITION D'UN VEHICULE,"MARCHE, VEHICULE 4X4, SONABHY, CFAO MOTORS.",(CONTRAT),"30. AOUT, 2010."
0214/CJ,MARCHE N°37/2010 POUR L'ACQUISITION D'UNE AMBULANCE DU 30 AOUT 2010 + CONTRAT D'ENTRETIEN N°16/0371 DU 06 SEPTEMBRE 2016 : SONABHY ET CFAO MOTORS,"MARCHE, AMBULANCE, SONABHY, CFAO MOTORS, ASCENSEUR, ENTRETIEN.",(CONTRAT),"2010, 2016."
0215/CJ,MARCHE N°41/2010 POUR LA FOURNITURE D'UN POSTE,"MARCHE, POSTE TELEPHONIQUE ADF, SONABHY, STEA.",(CONTRAT),"22. SEPTEMBRE, 2010."
0216/CJ,MARCHE N°42/2010 POUR LA FOURNITURES DE RADIOS,"MARCHE, RADIO PORTATIF, SONABHY, STEA.",(CONTRAT),"28. SEPTEMBRE, 2010."
0217/CJ,MARCHE N°44/2010 POUR LA FOURNITURE DE MATERIEL,"MARCHE, MATERIEL ELECTRIQUE, SONABHY, STEA.",(CONTRAT),"22. SEPTEMBRE, 2010."
0218/CJ,,,,
0219/CJ,MARCHE N°43/2010 POUR LA FOURNITURE DE POSTES,"MARCHE, POSTE TELEPHONIQUE BALADEUR, SONABHY, FOF ELECTRONIQUE.",(CONTRAT),"28. SEPTEMBRE, 2010."
0220/CJ,CONTRAT TRADE DE 70 000 TM DE GASOIL : SONABHY ET TRAFIGURA DU 30 DECEMBRE 2010,"VENTE, GASOIL, SONABHY, TRAFIGURA.",(CONTRAT),"30. DECEMBRE, 2010."
0221/CJ,CONTRAT DE VENTE DE PRODUITS PETROLIERS : SONABHY ET PETROLEUM SA DU 07-01-2011,"VENTE, PRODUIT PETROLIER, SONABHY, PETROLEUM SA.",(CONTRAT),"07. JANVIER, 2011."
0222/CJ,RENOUVELLEMENT DU CONTRAT DE TRAVAIL A DUREE,,,
0223/CJ,RENOUVELLEMENT DU CONTRAT DE TRAVAIL A DUREE,"TRAVAIL, SONABHY, NIKIEMA JEAN PAUL.",(CONTRAT),"07. JANVIER, 2011."
0224/CJ,RENOUVELLEMENT DU CONTRAT DE TRAVAIL A DUREE DETERMINEE DU 07 JANVIER 2011 + CONTRAT N°15/3628 DU 19 OCTOBRE 2015 : SONABHY ET DERA IDRISSA,"TRAVAIL, SONABHY, DERA IDRISSA.",(CONTRAT),2011. 2015.
0225/CJ,RENOUVELLEMENT DU CONTRAT DE TRAVAIL A DUREE,,,
2011,,"TRAVAIL, SONABHY, TAPSOBA AMIDOU.",(CONTRAT),"07. JANVIER, 2011."
0226/CJ,RENOUVELLEMENT DU CONTRAT DE TRAVAIL A DUREE,,,
2011,,"TRAVAIL, SONABHY, ZONGO OLIVIER.",,
0227/CJ,RENOUVELLEMENT DU CONTRAT DE TRAVAIL A DUREE,"TRAVAIL, SONABHY, N'DO BALEMA EMMANUEL.",(CONTRAT),"07. JANVIER, 2011."
0228/CJ,RENOUVELLEMENT DU CONTRAT DE TRAVAIL A DUREE,,,
2011,,"TRAVAIL, SONABHY, SIMPORE MATHIEU.",(CONTRAT),"07. JANVIER, 2011."
0229/CJ,RENOUVELLEMENT DU CONTRAT DE TRAVAIL A DUREE,"TRAVAIL, SONABHY, ZONGO ALI.",(CONTRAT),"07. JANVIER, 2011."
0230/CJ,RENOUVELLEMENT DU CONTRAT DE TRAVAIL A DUREE,,,
2011,,"TRAVAIL, SONABHY, OUEDRAOGO PAUL.",(CONTRAT),"07. JANVIER, 2011."
0231/CJ,RENOUVELLEMENT DU CONTRAT DE TRAVAIL A DUREE,,,
2011,,"TRAVAIL, SONABHY, KALMOGO DANIEL.",(CONTRAT),"07. JANVIER, 2011."
0232/CJ,RENOUVELLEMENT DU CONTRAT DE TRAVAIL A DUREE,,,
2011,,"TRAVAIL, SONABHY, SAKANDE OUSMANE.",(CONTRAT),"07. JANVIER, 2011."
0233/CJ,RENOUVELLEMENT DU CONTRAT DE TRAVAIL A DUREE DETERMINEE DU 07 JANVIER 2011 + CONTRAT DE JUILLET 2015 + CONTRAT N°15/3625 DU 19 OCTOBRE 2015 : SONABHY ET SIMPORE MATHIAS,"TRAVAIL, SONABHY, SIMPORE MATHIAS, OUVRIER.",(CONTRAT),2011. 2015.
0234/CJ,RENOUVELLEMENT DU CONTRAT DE TRAVAIL A DUREE,"TRAVAIL, SONABHY, KALMOGO GERMAINE.",(CONTRAT),"07. JANVIER, 2011."
0235/CJ,JURIDICTION ET CONTENTIEUX : CONTRAT DE TRANSPORT DE PRODUITS PETROLIERS N°11/037 DU 18 MAI 2011 + CONTRAT N°18/0103 DU 03 FEVRIER 2018 : SONABHY ET OUATTARA ALY (ENTREPRISE BADRA),"TRANSPORT, PRODUIT PETROLIER, OUATTARA ALY, SONABHY, ENTREPRISE BADRA.",(CONTRAT),2011. 2018.
0236/CJ,CONVENTION DE DECOUVERT : SONABHY ET BANQUE ATLANTIQUE DU 30 NOVEMBRE 2010,"CONVENTION, DECOUVERT, SONABHY, BANQUE ATLANTIQUE.",(CONTRAT),"30. NOVEMBRE, 2010."
0237/CJ,"CONTRAT DES ENVOIS ""POST ECLAIR"" ET LEUR TRAITEMENT : SONABHY ET SONAPOST DU 11 NOVEMBRE 2010","COURRIER, ENVOI, POST ECLAIR, SONABHY, SONAPOST.",(CONTRAT),"11. NOVEMBRE, 2010."
0238/CJ,CONTRAT DE FOURNITURE DE PRODUITS PETROLIERS : SONABHY ET PLUF DU 22 OCTOBRE 2002,"VENTE, PRODUIT PETROLIER, PLUF, SONABHY.",(CONTRAT),"22. OCTOBRE, 2002."
0239/CJ,JURIDICTION ET CONTENTIEUX : CONTRAT DE FOURNITURE DE PRODUITS PETROLIERS DU 27 NOVEMBRE 2001 + CONVENTION DE FOURNITURE DE DDO DU 31 MAI 2004 + CONTRAT N°14/206 DU 26 DECEMBRE 2014 + CONTRAT DE VENTE N°17/0596 DU 28 DECEMBRE 2017 + PROTOCOLE D'ACCORD N°19/0006 DU 14 JANVIER 2019 + AVENANT N°23/0417 DU 05 SEPTEMBRE 2023 + CONTRAT DE VENTE N°22/0495 DU 19 SEPTEMBRE 2022 + AVENANT N°22/0524 DU 03 OCTOBRE 2022 : SONABHY ET ECODIS + CONTRAT DE VENTE N°21/0305 DU 11 OCTOBRE 2021 + CONTRAT DE VENTE SPOT N°23/0243 DU 26 AVRIL 2023 + AVENANT N°23/0338 DU 26 JUIN 2023 + AVENANT N°23/0434 DU 13 SEPTEMBRE 2023 : SONABHY ET ECODIS ; ET TERRA SALIF,"VENTE, PRODUIT PETROLIER, DDO, ECODIS, TERRA SALIF.","(CONTRAT, AVENANT, PROTOCOLE D'ACCORD)",2001. 2004. 2014. 2017. 2019. 2021. 2022. 2023.
0240/CJ,JURIDICTION ET CONTENTIEUX : CONTRAT DE FOURNITURE,"VENTE, PRODUIT PETROLIER, ORYX BURKINA, SONABHY.",(CONTRAT),"05. NOVEMBRE, 2003."
0241/CJ,CONTRAT DE MANDAT DE GERANCE : SONABHY ET TOTAL BURKINA DU 01 JUIN 2005,"GERANCE, TRANSPORT, TOTAL BURKINA, SONABHY.",(CONTRAT),"01. JUIN, 2005."
0242/CJ,CONTRAT DE VENTE DE PRODUITS PETROLIERS DU 13 NOVEMBRE 2003 + AVENANT N°1 DU 28 MAI 2004 + AVENANT N°5 DU 14 MARS 2012 : SONABHY ET ADDAX,"VENTE, PRODUIT PETROLIER, ADDAX, SONABHY.",,
0243/CJ,CONTRAT DE PASSAGE ET DE STOCKAGE : SONABHY ET STSL DU 15 MARS 2006,"VENTE, SONABHY.",(CONTRAT),"15. MARS, 2006."
0244/CJ,JURIDICTION ET CONTENTIEUX : TRANSPORT DE PRODUITS PETROLIERS ; AVENANT N°16/164 DU 03 MAI 2016 + CONTRAT N°22/0297 DU 06 JUIN 2022 : SONABHY ET COMPAORE HALIDOU (ECOMAF),"TRANSPORT, PRODUIT PETROLIER, COMPAORE HALIDOU, ECOMAF, SONABHY.",(AVENANT),2016.
