reference,cote,auteur,titre,publication,pagination,descripteurs
001CE.0001,001CE.0001,AFNOR,Catalogue 1993 : 49ème édition : des normes pour se mesurer,"Paris : AFNOR, 1993",919p,/CATALOGUE//NORME/
002CE.0002,002CE.0002,AFNOR,Catalogue des recueils de normes 1993,"Paris : AFNOR, 1993",35p,/NORME//CATALOGUE/
003CE.0003,003CE.0003,SIFOR,Catalogue des actions de formation programmées pour 1989,"Paris : SIFOR, 1989",no pag,/CATALOGUE//FORMATION/
004CE.0004,004CE.0004,SIFOR,Catalogue des actions de formation année 1990,"Paris : éd. SIFOR, 1990",No pag,/CATALOGUE//FORMATION/
005AN.0008,005AN.0008,UAPT,Annuaire officiel télex télécopie 1994-1995,"Lomé : UAPT, s.d.",mult pag,/ANNUAIRE//TELECOPIE/
006AN.0009,006AN.0009,HELIOS EDITION,Hélioscope : l'annuaire professionnel du Faso 1996/1997,"Ouagadougou : HELIOS éd., s.d.",232p,/ANNUAIRE//PROFESSION//COMMERCE/INDUSTRIE//BURKINA FASO/
007AN.0010,007AN.0010,CCIA-BF,Annuaire des entreprises 1989-1990,"Ouagadougou : CCIA, s.d.",147p,/ANNUAIRE//ENTREPRISE//BURKINA FASO/
008AN.0011,008AN.0011,SPI,Ecocarte : magasins et services affiliés,"s.l. : SPI, 1994",177p,/ANNUAIRE//COMMERCE//PROFESSION/
009AN.0012,009AN.0012,HEC,"MBA maîtrise en administration des affaires, DSA diplôme en sciences administratives : annuaire 91-92","Montréal : HEC, 1991",48p,/ANNUAIRE//ADMINISTRATION//FORMATION//SCIENCE/
010AN.0013,010AN.0013,SONABHY,Annuaire statistique 1994,"Ouagadougou : SONABHY, 1995",25p,/ANNUAIRE//STATISTIQUE//PRODUIT PETROLIER//BURKINA FASO/
011CM.0001,011CM.0001,MANUTAN,Export Manutan : matériel de manutention et d'équipement industriel 1993,"Paris : MANUTAN, 1993",872p,/CATALOGUE//MANUTENTION//MATERIEL//EQUIPEMENT//INDUSTRIE/
012CM.0002,012CM.0002,MANUTAN,Export Manutan : matériel de manutention et d'équipement industriel 1994,"Paris : MANUTAN, 1994",904p,/CATALOGUE//MANUTENTION//MATERIEL//EQUIPEMENT//INDUSTRIE/
013CM.0003,013CM.0003,MANUTAN,Export Manutan : matériel de manutention et d'équipement industriel 1997,"Paris : MANUTAN, 1997",1076p,/CATALOGUE//MANUTENTION//MATERIEL//EQUIPEMENT//INDUSTRIE/
014CM.0004,014CM.0004,MANUTAN,Export Manutan : matériel de manutention et d'équipement industriel 1998,"Paris : MANUTAN, 1998",1099p,/CATALOGUE//MANUTENTION//MATERIEL//EQUIPEMENT//INDUSTRIE/
015CM.0005,015CM.0005,JM BRUNEAU,Le N°1 de l'équipement de bureau par correspondance Janvier 1997,"s.l. : JM BRUNEAU, 1997",311p,/CATALOGUE//EQUIPEMENT//BUREAU/
016CM.0006,016CM.0006,JM BRUNEAU,Le N°1 de l'équipement de bureau par correspondance Juin 1997,"s.l. : JM BRUNEAU, 1997",331p,/CATALOGUE//EQUIPEMENT//BUREAU/
017CM.0007,017CM.0007,JM BRUNEAU,Le N°1 de l'équipement de bureau par correspondance Septembre 1997,"s.l. : JM BRUNEAU, 1997",399p,/CATALOGUE//EQUIPEMENT//BUREAU/
018CE.0005,018CE.0005,EDITION TECHNIP,Catalogue 1996 : Our books in English at the end of this catalog,"Paris : éd. Technip, 1995",196p,/CATALOGUE//EDITION//LIVRE/
019AU.0001,019AU.0001,Villeguérin Erik (de la),Dictionnaire fiduciaire financier,"Pari : éd. Villeguérin, 1988",414p,/DICTIONNAIRE//FINANCE//COMPTABILITE/
020CM.0008,020CM.0008,MARC GERARD,Visserie de qualité : catalogue,"lièg : MARC-GERARD, s.d.",127p,/CATALOGUE//VISSERIE//MATERIEL/
021CM.0009,021CM.0009,MANUTAN,Manutan export : editions spéciales,"Paris : MANUTAN, s.d.",273p,/CATALOGUE//EQUIPEMENT//MATERIEL/
022CM.0010,022CM.0010,MANUTAN,Manutan Export,"Paris : MANUTAN, s.d.",705p,/CATALOGUE//EQUIPEMENT//MATERIEL/
023CM.0011,023CM.0011,GERNI,CATALOGUE 1996,"Morangis : GERNI, s.d.",47p,/CATALOGUE//EQUIPEMENT//MATERIEL/
024CE.0006,024CE.0006,LEFEBVRE Francis,L'actualité des éditions Francis Lefebvre,"Levallois : EFL, 2000",no pag,/CATALOGUE//EDITION//LIVRE/
025AN.0014,025AN.0014,BCEAO,Notes d'information et statistiques Janvier 1989,"Dakar : BCEAO, 1989",Mult pag,/ANNUAIRE//STATISTIQUE//BCEAO/
026AN.0015,026AN.0015,BCEAO,Notes d'information et statistiques fevrier 1989,"Dakar : BCEAO, 1989",Mult pag,/ANNUAIRE//STATISTIQUE//BCEAO/
027AN.0016,027AN.0016,BCEAO,Notes d'information et statistiques Mars 1989,"Dakar : BCEAO, 1989",Mult pag,/ANNUAIRE//STATISTIQUE//BCEAO/
028AN.0017,028AN.0017,BCEAO,Notes d'information et statistiques Avril 1989,"Dakar : BCEAO, 1989",Mult pag,/ANNUAIRE//STATISTIQUE//BCEAO/
029AN.0018,029AN.0018,BCEAO,Notes d'information et statistiques Mai 1989,"Dakar : BCEAO, 1989",Mult pag,/ANNUAIRE//STATISTIQUE//BCEAO/
030AN.0019,030AN.0019,BCEAO,Notes d'information et statistiques Juillet 1989,"Dakar : BCEAO, 1989",Mult pag,/ANNUAIRE//STATISTIQUE//BCEAO/
031CM.0012,031CM.0012,JM BRUNEAU,N°1 de l'équipement de bureau par correspondance 1995,"s.l. : JM BRUNEAU, 1995",251p,/CATALOGUE//EQUIPEMENT//BUREAU/
032CM.0013,032CM.0013,MANUTAN,Export Manutan : Matériel de manutention et d'équipement industriel,"Paris : MANUTAN, 1995",952p,/CATALOGUE//EQUIPEMENT//INDUSTRIE/
033CM.0014,033CM.0014,MANUTAN,Export Manutan : Materiel de manutention et d'équipement industriel,"Paris : MANUTAN, 1996",1016p,/CATALOGUE//EQUIPEMENT//INDUSTRIE/
034AN.0020,034AN.0020,CCIA-BF,Annuaire des entreprises 1994,"Ouagadougou : CCIA, 1994",NO PAG,/ANNUAIRE//ENTREPRISE//BURKINA FASO/
035AN.0021,035AN.0021,CEDEAO,Annuaire financier de la CEDEAO 1996/1998 = ECOWAS financial directory 1996/1998,"s.l. : CEDEAO, 1998",386p,/ANNUAIRE//FINANCE//CEDEAO/
036AN.0022,036AN.0022,BURKINA FASO,Annuaire officiel du Ministère de l'emploi du travail et de la sécurité sociale 1998/1999,".l. : s.n., 1999",207p,/ANNUAIRE//EMPLOI//SECURITE SOCIALE//BURKINA FASO/
037AN.0023,037AN.0023,MALAYSIA,The national chamber of commerce and industry of Malaysia 1997,"Kuala Lumpur : NCCIM, 1997",96p,/REPERTOIRE//COMMERCE//INDUSTRIE//MALAISIE/
038CE.0007,038CE.0007,TECHNICAL STANDARDS SERVICE LTD,Energy catalogue 1998-1999,"s.l. : INTERNATIONAL EDITION, 1999",19p,/CATALOGUE//ENERGIE/
039CE.0008,039CE.0008,Petrolum indutry and related sciences and technologies,,"s.l. : éd. TECHNIP, s.d.",72p,/CATALOGUE//INDUSTRIE PETROLIERE//
040CE.0009,040CE.0009,EDITION TECHNIP,Catalogue 1995 : our books in English at the end of this catalog.,"s.l. : Ed TECHNIP, s.d.",189p,/CATALOGUE//EDITION//LIVRE/
041CM.0015,041CM.0015,MANUTAN,Matériel de manutention et d'équipement industriel,"Paris : MANUTAN, 1991",760p,/CATALOGUE//EQUIPEMENT//INDUSTRIE/
042CE.0010,042CE.0010,TECHNICAL STANDARDS SERVICE LT,Energy catalogue 1999 N°1,"s.l. : INTERNATIONAL EDITION, 1999",19p,/CATALOGUE//ENERGIE/
043AN.0024,043AN.0024,BCEAO,Note d'information et statistiques Octobre 1988 N° 375,"Dakar : BCEAO, 1988",Mult pag,/ANNUAIRE//STATISTIQUE//BCEAO/
044AN.0025,044AN.0025,BCEAO,Note d'information et statistiques Juillet 1988 N°373,"Dakar : BCEAO, 1988",Mult pag,/ANNUAIRE//STATISTIQUE//BCEAO/
045AN.0026,045AN.0026,BCEAO,Note d'information et statistiques Juin 1988 N°372,"Dakar : BCEAO, 1988",Mult pag,/ANNUAIRE//STATISTIQUE//BCEAO/
046AN.0027,046AN.0027,BCEAO,Note d'information et statistiques Mai 1988 N°371,"Dakar : BCEAO, 1988",Mult pag,/ANNUAIRE//STATISTIQUE//BCEAO/
047AN.0028,047AN.0028,BCEAO,Note d'information et statistiques Aout - Septembre 1988 N°374,"Dakar : BCEAO, 1988",Mult pag,/ANNUAIRE//STATISTIQUE//BCEAO/
048CM.0016,048CM.0016,JM BRUNEAU,Le N°1 de l'équipement de bureau par correspondance Septembre 1996,"s.l. : s.n., 1996",no pag,/CATALOGUE//EQUIPEMENT//BUREAU/
049RE.0001,049RE.0001,SOCIETE GENERALE DE SURVEILLANCE,Redwood products tables,"Genève : SGS, s.d.",no pag,/REPERTOIRE//COMMERCE/
050RE.0002,050RE.0002,D.E.R. LTD,ECOWAS FINANCIAL DIRECTORY,"s.l. : DER LTD, s.d.",482p,/REPERTOIRE//FINANCE//CEDEAO/
051AN.0029,051AN.0029,FRANCE AFRIQUE,L'annuaire des sociétés et fournisseurs,"s.l. : IC PUBLICATION, 1992",1225p,/ANNUAIRE//SOCIETE//COMMERCE/
052CE.0011,052CE.0011,EDITION TECHNIP,Listes des prix octobre1985,"s.l. : éd. TECHNIP, 1985",37p,/CATALOGUE//LIVRE//EDITION/
053RE.0003,053RE.0003,ECOLE NATIONALE SUPERIEURE DU PETROLE ET DES MOTEURS,Repertoires des stages de formation,"s.l. : s.n., 1992",177p,/REPERTOIRE//STAGE//PETROLE/
055CE.0012,055CE.0012,AFNOR,Catalogue,"s.l. : AFNOR, 1986",30p,/CATALOGUE//AFNOR/
056AN.0030,056AN.0030,HELIOSCOPE,L'annuaire professionnel du Faso 1996/1997,"s.l. : s.n., 1997",232p,/ANNUAIRE//BURKINA FASO//COMMERCE//ENTREPRISE/
057CM.0017,057CM.0017,INMAC,Idées pour l'informatique,"Paris : INMAC, 1991",145p,/CATALOGUE//MATERIEL//INFORMATIQUE/
058CM.0018,058CM.0018,MANUTAN,Matériel de manutention et d'équipement industriel,"Paris : MANUTAN, s.d.",664p,/CATALOGUE//EQUIPEMENT//INDUSTRIE//MANUTENTION/
059CM.0019,059CM.0019,JM BRUNEAU,Le N°1 de l'équipement de bureau par correspondance Janvier 1994,"Paris : JM BRUNEAU, 1994",239p,/CATALOGUE//EQUIPEMENT//BUREAU/
060AN.0031,060AN.0031,THE NEW ICC WORLD DIRECTORY OF CHAMBERS OF COMMERCE,Nouvel annuaire mondial cci des chambres de commerce 1990,551p,,/ANNUAIRE//CHAMBRE//COMMERCE/
061AN.0032,061AN.0032,SONABHY,Annuaire statistique 1993,"OUAGA : SONABHY,s.d.,",30p,/ANNUAIRE//STATISTIQUE/
062AN.0033,062AN.0033,SONABHY,Statistiques 1er semestre 1994,"OUAGA : SONABHY, 1994",18P,/STATISTIQUE//SEMESTRE/
063AN.0034,063AN.0034,SONABHY,Annuaire statistique 1995,"OUAGA : SONABHY, 1996",35P,/ANNUAIRE//STATISTIQUE/
064AN.0035,064AN.0035,SONABHY,Annuaire statistique 1997,"OUAGA : SONABHY, 1998",44P,/ANNUAIRE//STATISTIQUE/
065RE.0004,065RE.0004,IFP,Répertoire des stages de formation éd.1991 : E.N.S.P.M,"s.l. : IFP, 1990",171P,/REPERTOIRE//STAGE//FORMATION/
066RE.0005,066RE.0005,IFP,"Worldwide tanker nominal freight scale ""worldscale""","s.l : s.n, 1985",481p,
067RE.0006,067RE.0006,REUTERS LTD,The reuter money 2000 service : directory,"LONDON : REUTER LTD, 1990",46P,/REPERTOIRE//FINANCE/
068RE.0007,068RE.0007,REUTERS LTD,The reuter futures 2000 service : directory,"LONDON : REUTERS LTD, 1990",71P,/REPERTOIRE//COMMERCE/
069AU.0002,069AU.0002,REUTERS LTD,User guide : the reuter futures 2000 service,"LONDON : REUTERS LTD, 1990",42P,/REPERTOIRE//AFRIQUE//COMMERCE GENERAL/
073RE.0008,073RE.0008,SEPI,Répertoire des fournisseurs de l ' Afrique FANE 2002,"PARIS : SEPI, 2002",236P,
074CE.0013,074CE.0013,EDITION LAMY,Catalogue 2000,"PARIS : éd.LAMI, 2000",82p,
075AN.0039,075AN.0039,EPI AFRIQUE,Les pages jaunes Afrique 2000-2001,"Nice : EPI Afrique,",482p,/ANNUAIRE//TELEPHONE//AFRIQUE/
076AN.0040,076AN.0040,BCEAO,Note d'information statistiques février 1988,"OUAGA : BCEAO, 1988",mult.pag.,/INFORMATION//STATISTIQUE/
077AN.0041,077AN.0041,BCEAO,Note d'information statistiques mars 1988,"OUAGA : BCEAO, 1988",mult.pag.,/INFORMATION//STATISTIQUE/
078AN.0042,078AN.0042,BCEAO,Note d'information statistiques avril 1988,"OUAGA : BCEAO, 1988",mult.pag.,/INFORMATION//STATISTIQUE/
079AN.0043,079AN.0043,SONABHY (BOBO),Statistiques année 2000 : dépot BOBO,"BOBO : SONABHY, 2001",63p,/STATISTIQUE//SONABHY//BOBO/
080AN.0044,080AN.0044,BCEAO,Note d'information statistiques février n° 358,"OUAGA : BCEAO, 1987",mult.pag.,/INFORMATION//STATISTIQUE//BCEAO/
081AN.0045,081AN.0045,BCEAO,Note d'information statistiques mars n° 358,"OUAGA : BCEAO, 1987",mult.pag.,/INFORMATION//STATISTIQUE//BCEAO/
082AN.0046,082AN.0046,BCEAO,Note d'information statistiques juillet n° 362,"OUAGA : BCEAO, 1987",mult.pag.,/INFORMATION//STATISTIQUE//BCEAO/
083AN.0047,083AN.0047,BCEAO,Note d'information statistiques aout-septembre n° 363,"OUAGA : BCEAO, 1987",mult.pag.,/INFORMATION//STATISTIQUE//BCEAO/
084AN.0048,084AN.0048,BCEAO,Note d'information statistiques octobre n° 364,"OUAGA : BCEAO, 1987",mult.pag.,/INFORMATION//STATISTIQUE//BCEAO/
085AU.0002,085AU.0002,EDITION QUILLET,Dictionnaire quillet de la langue française A-C,"PARIS : éd. QUILLET, 1975",no.pag.,/DICTIONNAIRE//FRANCAIS/
086AU.0003,086AU.0003,EDITION QUILLET,Dictionnaire QUILLET de la langue française D-J,"PARIS : éd. QUILLET, 1975",no.pag.,/DICTIONNAIRE//FRANCAIS/
087AU.0004,087AU.0004,EDITION QUILLET,Dictionnaire QUILLET de la langue française K-P,"PARIS : éd. QUILLET, 1975",no.pag.,/DICTIONNAIRE//FRANCAIS/
088AU.0005,088AU.0005,EDITION QUILLET,Dictionnaire QUILLET de la langue française Q-Z,"PARIS : éd. QUILLET, 1975",no.pag.,/DICTIONNAIRE//FRANCAIS/
089AN.0049,089AN.0049,SONABHY,Annuaire statistiques 1996,"OUAGA : SONABHY, 1997",34p,/ANNUAIRE//STATISTIQUE//SONABHY/
090CE.0014,090CE.0014,KARTHALA,Catalogue 2003 karthala,"PARIS : KARTHALA, 2003",136p,/CATALOGUE//PUBLICATION/
091CE.0015,091CE.0015,GROUPE LIAISONS,Social et ressources humaines : publications et CD-ROM 2000,"RUEIL - M : G L, 2000",22p,/RESSOURCES HUMAINES//PUBLICATION//CD - ROM/
092CE.0016,092CE.0016,RF MULTIMEDIA,Catalogue 2000,"PARIS : REVUE FIDUCIAIRE, 2000",61p,/CATALOGUE//PUBLICATION/
093CE.0017,093CE.0017,KARTHALA,Catalogue 2004,"PARIS : KARTHALA, 2004",144p,/CATALOGUE//PUBLICATION/
094CE.0018,094CE.0018,INSTITUT DE L'AUDIT INTERNE,Publications 1999,"PARIS : IFACI, 1999",26p,/PUBLICATION//AUDIT INTERNE/
095AV.0006,095AV.0006,MICROGRAFX,MICROGRAFX Network Installation Guide,"Richardson : MICROGRAFX, 1997",68p,/NETWORK//INSTALLATION//GUIDE/
096AV.0007,096AV.0007,HEWLETT PACKARD,Sept étapes pour installer l'imprimante,"s.l : HPI, s.d",no pag,/ORDINATEUR//INSTALLATION//IMPRIMANTE/
097AV.0008,097AV.0008,HEWLETT PACKARD,Informations supplémentaires: au sujet de l'imprimante HP deskjet 690 séries,"s.l : HP, 1996",24p,/ORDINATEUR//INFORMATION//IMPRIMANTE/
098AV.0009,098AV.0009,HEWLETT PACKARD,Savoir imprimer: guide d'utilisation de l'imprimante HP deskjet 690c séries,"s.l : HP, 1996",46p,/ORDINATEUR//GUIDE//IMPRIMANTE/
099CE.0019,099CE.0019,UNISYS,Catalogue de formation,"s.l : UNISYS, s.d",mult.pag,/UNISYS//CATALOGUE//FORMATION/
100CE.0020,100CE.0020,LOVOISIER,LE CAT': Instrumentation industrielle,"PARIS : LAVOISIER, 2004",31p,/INSTRUMENTATION//INDUSTRIE//LAVOISIER/
101CE.0021,101CE.0021,LOVOISIER,LE CAT': Génie des procédés,"PARIS : LAVOISIER, 2003",15p,/GENIE//PROCEDURE//LAVOISIER/
102CE.0022,102CE.0022,LOVOISIER,LE CAT': Environnement Pollution,"PARIS : LAVOISIER, 2003",39p,/ENVIRONNEMENT//POLLUTION//LAVOISIER/
103CE.0023,103CE.0023,LOVOISIER,LE CAT': Sciences de la terre,"PARIS : LAVOISIER, 2004",23p,/SCIENCE//TERRE//LAVOISIER/
104CE.0024,104CE.0024,LOVOISIER,"LE CAT': Révues, tarifs d'abonnement 2003","PARIS : LAVOISIER, 2003",29p,/TARIF//ABONNEMENT//LAVOISIER/
105AN.0050,105AN.0050,SONABHY,Annuaire statistique 1999,"OUAGADOUGOU : SONABHY, 1999",47p,/SONABHY//ANNUAIRE//STATISTIQUE/
106CE.0025,106CE.0025,LAVOISIER,HERMES Science publications,"PARIS : LAVOISIER, 2004",55p,/SCIENCE//PUBLICATION//LAVOISIER/
107CE.0026,107CE.0026,LAVOISIER,HERMES Science publications janvier 2005,"PARIS : LAVOISIER, 2005",14p,/SCIENCE//PUBLICATION//LAVOISIER/
108AN.0051,108AN.0051,SONABHY (bobo),Statistiques au 30 juin 1998,"BOBO : SONABHY, s.d",no.pag.,/STATISTIQUE//SONABHY//BOBO/
109CE.0027,109CE.0027,LAVOISIER,Le cat': révues,"PARIS : LAVOISIER, 2005",37P.,/LAVOISIER//REVUE//LE CAT'S/
110RE.0009,110RE.0009,CCIA-BF,"Répertoires des associations, groupement et ordres professionnels d'entreprises: RAGOPE'2003","OUAGA : CCIA-BF, 2003",37P.,/REPERTOIRE//ASSOCIATION//PROFESSIONNEL
111RE.0010,111RE.0010,FANE,Directory of suppliers to Africa: répertoires des fournisseurs d'Afrique,"s.l : SEPI, 2002",220P.,/REPERTOIRE//FOURNISSEURS//AFRIQUE/FANE/
112CE.0028,112CE.0028,EDITIONS LIAISONS,Catalogue 2001,"PARIS : éd.liaisons, 2001",27P.,/CATALOGUE//EDITION//LIAISONS SOCIALES//PARIS/
113AN.0052,113AN.0052,U.C.C.A,Annuaire de l'union des conseils des chargeurs africains: yearbook of union of African guidders's councils,"Abidjan : challenge communication, 1999",201P: ill. en coul.,/CHARGEUR//TRANSPORT//MARCHANDISE//AFRIQUE/
114AN.0053,114AN.0053,APBEF-B,Le finacier du Burkina: annuaire burkinabè de l'espace financier,"Ouaga : APBEF-B,",150P: ill. en coul.,/FINANCE//BANQUE//ETABLISSEMENT FINANCIER//ECONOMIE/
115CE.0029,115CE.0029,KARTHALA,Catalogue 2005,"PARIS : KARTHALA, 2005",144P.,/CATALOGUE//DOCUMENTATION/
116CM.0020,116CM.0020,KOCKC,"Power possive wook, et beautiful desigh à la combinaison, that will last for","s.l : KOCKC, Desigh will last forever",27P.,/MATERIEL//MEUBLE//BOIS/
117AN.0054,117AN.0054,APBEF-B,Annuaire burkinabe de l'espace financier,"Ouagadougou : APBEF-B, 2003",196P.:ill.en coul.,/ANNUAIRE//BANQUE//ETABLISSEMENT FINANCIER/
118AN.0055,118AN.0055,INSD,Annuaire statistique du Burkina Faso 1987,"Ouagadougou : INSD, 1987",252p,/DEMOGRAPHIE//STATISTIQUE//BURKINA FASO/
119AN.0056,119AN.0056,BCEAO,"Notes d'information et statistiques, juin 1989 N°383","Dakar : BCEAO, 1989",mult pag.,/BANQUE//ECONOMIE//MONNAIE//AFRIQUE/
120CE.0030,120CE.0030,LIAISONS SOCIALES,Le catalogue des formations 2006,"Rueil-Malmaison : Liaisons Sociales, 2005",69p : ill en coul,/FORMATION//DROIT SOCIAL//RESSOURCES HUMAINES//RELATION
121RE.0011,121RE.0011,CNLS-IST,Guide repertoire des acteurs de la lutte contre le VIH/SIDA,"Ouagadougou : CNLS-IST, 2005",95p,/VIH-SIDA//MALADIE SEXUELLEMENT TRANSMISSIBLE//BURKINA
122RE.0012,122RE.0012,ASSOCIATION PROFESSIONNELLE DE LA MAINTENANCE DU BURKINA,Repertoire des établissements d'enseignement technique et professionnel du Burkina Faso,"Ouagadougou : APMB, s.d.",168p,/MAINTENANCE//ENSEIGNEMENT TECHNIQUE//ENSEIGNEMENT
123RE.0013,123RE.0013,ARAB PETROLEUM RESEARCH CENTER,Arab oil & gas directory 1991,"Paris : APRC, 1991",608p,/PETROLE//GAZ//INDUSTRIE PETROLIERE/
124AU.0010,124AU.0010,CACALY Serge ; LE COADIC Yves F. ; POMART Paul-Dominique ;,SUTTER Eric Dictionnaire de l'information,"Paris : Armand Colin, 2004",274p,/DICTIONNAIRE//INFORMATION//DOCUMENTATION/
125CE.0031,125CE.0031,KARTHALA,CATALOGUE 2007,"Paris : KARTHALA, 2007","48p : ill, couv. ill. en coul.",/CATALOGUE//DOCUMENTATION/
126CE.0032,126CE.0032,L'ENTREPRENEURSHIP,Publications 2004-2005 : solutions pour réussir,"Quebec : Les Ed de la Fondation de l'ENTREPRENEURSHIP,",,
127RE.0014,127RE.0014,CCIA-BF,Répertoire des entreprises et structures participantes,"Ouagadougou : CCIA, 2004",33p,/COMMERCE//INDUSTRIE//ARTISANAT//REPERTOIRE//BURKINA FASO/
128AU.0011,128AU.0011,BUREAU DE PROMOTION DU COMMERCE CANADA,Guide de l'exportation au Canada,"Ottawa : BPCC, 2002",38p,/EXPORTATION//COMMERCE//IMPORTATION//MARCHE//CANADA/
129AU.0012,129AU.0012,LA PETITE ACADEMIE,Premier dictionnaire burkinabé : 100 personnalités et 50 gouvernements de 1957-2007,"Ouagadougou : IPA, 2007",460p : ill en coul.,/PERSONNALITE BURKINABE//GOUVERNEMENT//BURKINA FASO/
130CM.0021,130CM.0021,STRUCKMOBILES,SuperStar,"s.l. : s.n., 2003",212p : ill. en coul.,/CATALOGUE//VEHICULE/
131AU.0013,131AU.0013,BURKINA FASO (MEF),Guide de l'acheteur public et repertoire des termes en usage dans les marchés publics au Burkina Faso,"Ouagadougou : IPR, 2000",181p,/PASSATION DE MARCHE//MARCHE PUBLIC//BURKINA FASO/
132AU.0014,132AU.0014,BURKINA FASO (MEF),Guide pratique du candidat aux marchés publics du Burkina Faso,"Ouagadougou : MEF, A2000",50p,/MARCHE PUBLIC//PASSATION DE MARCHE//COMMANDE
133AN.0057,133AN.0057,SONABHY,Annuaire statistique 1998,"Ouagadougou : SONABHY, s.d.",46p,/STATISTIQUE//HYDROCARBURE//APPROVISIONNEMENT//VENTE/
135RE.0015,135RE.0015,GROUP DEMOS,L'essentiel : Une sélection de 300 formations,"Paris : GROUP DEMOS, 2006.","194p. : couv. ill. en coul. , ill. en coul.",/FORMATION//COMPETENCE//RESSOURCE
141CM.0015,141CM.0015,Conseil Supérieur de la Communication,Guide de Regulateur des Médias,"ouagadougou : CSC, 2013",113p.,/REGULATION//MEDIAS//PRESSE/
142AN.0059,142AN.0059,Présidence du Faso(Grande Chancellerie du BURKINA),Annuaire des membres des ordres burkinabé de 1994-1997,"ouagadougou : CHORISTRI, (s.d)",115p.,/GRANDE CHANCELLERIE//ANNUAIRE//ORDRE BURKINABE/
143AN.0060,143AN.0060,Présidence du Faso(Grande Chancellerie du BURKINA),Annuaire des membres des ordres burkinabé de 1998-1999,"OUAGADOUGOU : CHORISTRI, (s.d)",130p.,/ANNUAIRE//ORDRE BURKINABE//GRANDE CHANCELLERIE// BURKINA
144CE.0033,144CE.0033,IFP TRAINING,Raffinage chimie : Catalogue des formations 2015 = Refining echemicals :course directory 2015,"Paris : IFP TRAINING, 2015",289p,/CATALOGUE//FORMATION PROFESSIONNELLE//RAFFINAGE//CHIMIE/
145RE.0016,145RE.0016,WORLD TRADE CONNECTION,THE INTERNATIONAL TRADE DIRECTORY,1171 P.,,/CATALOGUE//ADMINISTRATION//ORGANISATION
146RE.0017,146RE.0017,WORLDSCALE ASSOCIATION,NEW WORLDWIDE TANKER NOMINAL FREIGHT SCALE: APPLYING TO THE CARRIAGE OF OIL IN BULK,512 P.,,/ASSOCIATION//TRANSIT/
147AN.0061,147AN.0061,MINISTERE DE L'EMPLOI,ANNUAIRE OFFIFICIEL DU MINISTERE DE L'EMPOI DU TRAVAIL ET DE LA SECURITE SOCIAL,221 P.,,/O.I.T//TRAVAIL//SECURITE
148AU.0016,148AU.0016,MINISTERE DE L'ECONOMIE ET DES FINANCES,GUIDE OFFOCIEL FISCAL ET DOUANIER,303 P.,,/DOUANE//UEMOA//REGLEMENTATION//FISCALITE//CODE
149AU.0017,149AU.0017,MINISTERE DE L'ECONOMIE ET DES FINANCES,GUIDE OFFICIEL FISCAL ET DOUANIER,317 P.,,/DOUANE//BUDGET
150RE.0018,150RE.0018,ARAB PETROLEUM RESEARCH CENTER,ARAB OIL & GAS DIRECTORY,317 P.,,/PETROLE//GAZ//PAYS ARABE//COMMERCE//RAFFINAGE//REPERTOIRE/
151RE.0019,151RE.0019,ARAB PETROLEUM RESEARCH CENTER,ARAB OIL & GAS DIRECTORY,608P.,,/PAYS ARABE//PETROLE//GAZ//DEVELOPPEMENT
152AN.0062,152AN.0062,INSD,Annuaire statistique 2007,"Ouagadougou : INSD, 2007",427p,/STATISTIQUE//ANNUAIRE//POPULATION//DEMOGRAPHIE//ECONOMIE/
153AN.0063,153AN.0063,INSD,ANNUAIRE STATISTIQUE 2000,"Ouagadougou : SONABHY, 2000",41p,/STATISTIQUE//ANNUAIRE//SONABHY//PRODUIT PETROLIER/
154AN.0064,154AN.0064,MINISTERE DU COMMERCE DE L'INDUSTRIE ET DE L'ARTISANAT (BF),Annuaire statistique 2016,101p,,/STATISTIQUE//COMMERCE//ARTISANAT//INDUSTRIE//ENT
155AN.0065,155AN.0065,MINISTERE DU COMMERCE DE L'INDUSTRIE ET DE L'ARTISANAT (BF),"Tableau de bord : statistique du commerce, de l'industrie et de l'artisanat 2015",99p + graphiques,,/STATISTIQUE//COMMERCE//ARTISANAT//INDUSTRIE//ENT
156CM.0026,156CM.0026,UCOMPOINT,CATALOGUE: TABLETTES,17P,,/UCOMPOINT// CATALOGUE//CONSOMABLE INFORMATIQUE/
157AN.0066,157AN.0066,L'OPERATEUR DU FASO,L'ANNUAIRE DES PROFESSIONNELS,329P,,/ANNUAIRE// PROFESSION/
158CM.0027,158CM.0027,LINVAR,"STORAGE DIRECT: CHOICE, QUALITY , VALUE SERVICE",2668P,,/QUATALOGUE// MATIRIEL// EQUIPEMENT// MOBILIER DE BUREAU/
159AN.0067,159AN.0067,PRESIDENCE DU FASO,ANNUAIRE DES MEMBRES DES ORDRES BURKINABE ANNEE 2017,159p,,
160CM.0028,160CM.0028,VISION PUB,Commercialisation par l'objet : cadeaux d'affaires,"Ouaga : VISION PUB, 2017",16p,/COMMUNICATION//OBJET
161CM.0029,161CM.0029,CARLO ERBA,Chemicals 2017,"s.l. : DORIT GROUP, 2017",840p.,/MATERIEL MEDICAL//CATALOGUE//LABORATOIRE//EQUIPEMENT/
162AN.0068,162AN.0068,MINISTERE DU COMMERCE DE L'INDUSTRIE ET DE L'ARTISANAT,(BURKINA FASO) Annuaire statistique 2017,"Ouagadougou : MCIA, 2018",92p : ill. en coul. + tableaux,/ANNUAIRE//STATISTIQUE//INDUSTRIE//COMMERCE//ARTI
163CM.0030,163CM.0030,BLUETOOTH,Promotional products and more ...,"Ouagadougou : BLUETOOTH, 2018",306p : ill. en coul.,/CATALOGUE// PROMOTION//MATERIEL//MATERIEL
164CM.0031,164CM.0031,ABDOUL SERVICE INTERNATIONAL,CATALOGUE 2020,47p,,/CATALOGUE//IMMOBILIER//TERRAIN//VENTE/
165CM.0032,165CM.0032,MSA,SAFETY SCOPE : EQUIPEMENTS DE PROTECTION INDIVIDUELLE ET DETECTION DE GAZ.,135p,,/EQUIPEMENT//PROTECTION//DETECTION DE GAZ/
169AN.0071,169AN.0071,AUTORITR DE REGULATION DES  COMMUNICATIONS ELECTRONIQUES,ET DES POSTES ANNUAIRE TELEPHONIQUE BURKINA FASO 2018,58p. ILL EN COUL.,,/ANNUAIRE TELEPHONIQUE// TELEPHONE//COMMUNICATION/
172AN.0074,172AN.0074,ORION,L'OPERATEUR DU FASO: L'ANNUAIRE BURKINABE DES AFFAIRES,248pILL EN COUL.,,/ANNUAIRE PROFESSIONEL//TELEPHONE//COMMUNICATION/
176AU.0019,176AU.0019,SOCIETE NATIONALE BURKINABE D'HYDROCARBURES,LIVRE D'OR: INAUGURATION DU DEPOT D'HYDROCARBURES LIQUIDES DE LA SOCIETE NATIONALE BURKINABE D'HYDROCARBURESA PENI,SANS DE PAGINATION,,/INAUGURATION DEPOT DE PENI// PRODUIT PETROLIER//PREMIER
179RE.0020,179RE.0020,CNLS-IST BURKINA FASO,GUIDE: REPERTOIRE DES ACTEURS DE LA LUTTE CONTRE LE VIH/SIDA ET LES IST: PREMIERE EDITION 2005/2007,95p. ill en coul,,/REPERTOIRE// INFECTION
