COTE DE RANGEMENT,TITRE,AUTEURS PERS. PHYS.,NOTE,EDITEUR,DATE EDITION,COLLATION,MOTS CLES MATIERES,MOTS CLES GEO,OBSERVATIONS
 BIL.0018, COMPTES ET BILANS EXERCICES 1984 ET 1985 DE LA SEB,,, CABINET MICHEL SOGOSSIRA SANOU, 1986, 23 P + ANNEXES, BILAN COMPTE GESTION ACTIVITES SEB,,
 DLE.0040,,, NOUVELLES MESURES FISCALES, FISC CONSULTING INTERNATIONAL, 2009, 15 P, DROIT LEGISLATION FINANCE LOI DE FINANCE FISCALITE, BURKINA FASO,
 EVA.0002, RAPPORT DEFINITIF,, MISSION DE CONTROLE FACTURATION DES LIVRAISONS EN DROITURE 2000 ET 2001, ARYAN ET CO, MAI 2007, 36 P, RAPPORT FACTURATION DROITURE CONTROLE,,
 EVA.0003, RAPPORT DE MISSION D'AUDIT,, LA GESTION DES COULAGES TRANSPORT ET EXPLOITATION, COTROLE INTERNE, SEPTEMBRE 2007, MULT PAG, AUDIT RAPPORT AUDIT GESTION COULAGE TRANSPORT EXPLOITATION,,
 EVA.0004," TRAVAUX D'EVALUATION DES INVESTISSEMENTS ""MARKETERS"" AU DEPOT SEB",,, SONABHY OUAGA, 1986, MULT PAG, RAPPORT INVESTISSEMENT IMMOBILISATION SEB REEVALUATION,,
 EVA.0005, RAPPORT SUR COUT D'INDEMNISATION DES ACTIONNAIRES DE LA SEBHY ET DE LA SEB,,, SONABHY OUAGA, MAI 1988, MULT PAG, RAPPORT ACTIONNARIAT INDEMNISATION SEBHY SEB,,
 EVA.0006, EVALUATION DES DEPOTS PETROLIERS DE BOBO-DIOULASSO,, RAPPORT ETABLI LE 28 NOVEMBRE 1987, INGENIEURIE CIGMA, 28 NOVEMBRE 1987, 25 P + ANNEXES, RAPPORT SONABHY IMMOBILISATION,,
 EVA.0007, REEVALUATION DES IMMOBILISATIONS PROPRIETES DES MARKETERS DE LA SEB,,, SOFIDEC, NOVEMBRE 1987, MULT PAG, RAPPORT IMMOBILISATION SEB,,
 CMA.0041, CATALOGUE 2009,, LE MOTEUR DE VOS ACHATS, MANUTAN, 2008, 2538 P, MANUTAN CATALOGUE,,
 CMA.0042, CATALOGUE 2009,,, MANUTAN, 2009, 400 P, CATALOGUE MANUTAN,,
 EVA.0001, RAPPORT D'EVALUATION DU PATRIMOINE DE LA SEB BOBO,,, CABINET SOFIDEC, 1988, 14 P, RAPPORT PATRIMOINE SEB,,
 CMA.0001, CATALOGUE EDITION 2003,,, MANUTAN, 2002, 2400 P EN COUL, CATALOGUE MANUTAN,,
 CMA.0002, CATALOGUE EDITION 2005,,, MANUTAN, 2004, 2096 P EN COUL, CATALOGUE MANUTAN,,
 CM.0003, SYSTEME COMPLET DE TELEJAUGEAGE DE RESERVOIRS ET CONTROLE DE VANNES (WHESSMATIC 600),,, WHESSOE SA, SD, MULT PAG EN COUL, TELEJAUGEAGE CATALOGUE RESERVOIR VANNE SYSTEME TELEJAUGEAGE,,
 CM.0004, APPAREILS ET VERRERIE DE LABORATOIRE,,, OSI, 1993, 903 P EN COUL, CATALOGUE LABORATOIRE VERRERIE EQUIPEMENT,,
 CM.0005,,,, LEGRAND, 1986, 448 P EN COUL + GUIDE PRATIQUE 15 P, CATALOGUE ELECTRICITE,,
 CM.0006, CATALOGUE 1999-2000 (MATERIEL APICOLE),,, ICKOWICZ, 1998, 94 P EN COUL, CATALOGUE APICULTURE,,
 CMA.0007,,,, MANUTAN, 1988, 65 P EN COUL, CATALOGUE VISSERIE MANUTAN,,
 CMA.0008,,,, MANUTAN, 1989, 273 P EN COUL, CATALOGUE EQUIPEMENT INDUSTRIE MANUTAN,,
 CMA.0009,,,,,,, STAGE ETUDE FORMATION SECRETARIAT COMMUNICATION COMMUNICATION INTERNE,,
 ETU.0031,, NIMI Sétou, STAGE EFFECTUE DU 2 JUIN AU 4 AOUT 2005," NIMI, Sétou INSTITUT UNIVERSITAIRE DE TECHNOLOGIE (IUT)", 2005, 53 P, STAGE ETUDE FORMATION SECRETARIAT,,
 ETU.0032, RAPPORT DE STAGE, SANA Hamidou, STAGE EFFECTUE DU 1er JUIN AU 15 AOUT, MANUTAN, 1990, 273 P EN COUL, CATALOGUE MANUTENTIONNAIRE INDUSTRIE EQUIPEMENT MANUTAN,,
 CMA.0010,,,, MANUTAN, 1992, 785 P EN COUL, CATALOGUE MANUTAN MANUTENTIONNAIRE EQUIPEMENT INDUSTRIE,,
 CMA.0011,,,, MANUTAN, SD, 273 P EN COUL, CATALOGUE MANUTAN MANUTENTIONNAIRE INDUSTRIE EQUIPEMENT,,
 CMA.0012,,,, MANUTAN, 1991, 761 P EN COUL, MANUTAN CATALOGUE MANUTENTIONNAIRE INDUSTRIE EQUIPEMENT,,
 CMA.0013, CATALOGUE 292 - MATERIEL DE MANUTENTION ET EQUIPEMENT INDUSTRIEL,,, MANUTAN, 1992, 800 P EN COUL, CATALOGUE MANUTENTIONNAIRE EQUIPEMENT INDUSTRIE MANUTAN,,
 CMA.0014,,,, MANUTAN, SEPTEMBRE 1993, 872 P EN COUL, CATALOGUE MANUTAN MANUTENTIONNAIRE EQUIPEMENT INDUSTRIE,,
 CMA.0015,,,, MANUTAN, SEPTEMBRE 1994, 904 P EN COUL, CATALOGUE MANUTENTIONNAIRE INDUSTRIE EQUIPEMENT MANUTAN,,
 CMA.0016,,,, MANUTAN, 1996, 1016 P EN COUL, CATALOGUE MANUTAN MANUTENTIONNAIRE EQUIPEMENT INDUSTRIE,,
 CMA.0017,,,, MANUTAN, 1996, 81 P EN COUL, CATALOGUE MANUTAN MANUTENTIONNAIRE EQUIPEMENT INDUSTRIE,,
 CMA.0018,,,, MANUTAN, 2005, 80 P EN COUL, CATALOGUE MANUTAN RISQUE PROTECTION INDIVIDUELLE MAITRISE RISQUE MATERIEL DE PROTECTION,,
 CM.0019, 14001 GESTES AU QUOTIDIEN POUR BIEN VIVRE AU BUREAU,,," J. M., BRUNEAU", 2006, 706 P EN COUL, CATALOGUE CONSOMMABLE EQUIPEMENT MOBILIER,,
 CMA.0020,,,, MANUTAN, 2006, 80 P EN COUL, CATALOGUE RAYONNAGE EQUIPEMENT MANUTAN,,
 CMA.0021,,,, MANUTAN, 2006, 144 P EN COUL, CATALOGUE MANUTAN SECURITE EQUIPEMENT PROTECTION INDIVIDUELLE PREVENTION RISQUE EQUIPEMENT DE PROTECTION,,
 CMA.0022, CATALOGUE 2007,,, MANUTAN, 2007, 2386 P EN COUL, CATALOGUE MATERIEL MANUTAN EQUIPEMENT,,
 CMA.0023,,,, MANUTAN, 2007, 95 P EN COUL, CATALOGUE MANUTAN EQUIPEMENT,,
 CMA.0024,,,, MANUTAN, 2007, 31 P EN COUL, CATALOGUE MANUTAN EQUIPEMENT,,
 CMA.0025,,,, MANUTAN, 2007, 448 P EN COUL, CATALOGUE EQUIPEMENT MANUTAN,,
 CMA.0026,,,, MANUTAN, 2005, 2288 P EN COUL, CATALOGUE EQUIPEMENT MANUTAN,,
 CMA.0027,,,, MANUTAN, 2005, 111 P EN COUL, CATALOGUE EQUIPEMENT MANUTAN,,
 CMA.0028,,,, MANUTAN, 2007, 27 P EN COUL, CATALOGUE MANUTAN EQUIPEMENT,,
 CM.0029,,,, ETIF, 1999, 171 P EN COUL, CATALOGUE EQUIPEMENT PUBLICITE,,
 CM.0030,,,, ETIF, 1998, 183 P EN COUL, CATALOGUE EQUIPEMENT PUBLICITE,,
 CM.0031,,,, SYNERGIE, 2000, 130 P EN COUL, CATALOGUE EQUIPEMENT PUBLICITE,,
 CM.0032 2005,,,," SANA, Hamidou INSTITUT UNIVERSITAIRE DE TECHNOLOGIE (IUT)", 2005, 76 P, STAGE ETUDE FORMATION TECHNOLOGIE JAUGEAGE RESERVOIR SAAB TANKRADAR,,
 ETU.0033,, OUEDRAOGO Aminata, STAGE EFFECTUE DU 1er JUILLET AU 31 AOUT 2005, GROUPE SCHNEIDER ELECTRIC SA, 1998, 360 P EN COUL, CATALOGUE ELECTRICITE DISJONCTEUR INTERRUPTEUR TECHNOLOGIE,,
 CM.0033,,,, COMPAGNIE AFRICAINE DE MATERIEL PETROLIER (CAMP SANTE), 2002, MULT PAG EN COUL, CATALOGUE SANTE PROTECTION SECURITE MATERIEL DE PROTECTION,,
 CMA.0034,,,, MANUTAN, 2007, 384 P EN COUL, CATALOGUE EQUIPEMENT ENTREPOT MAGASIN,,
 CMA.0035,,,, MANUTAN, 2007, 450 P EN COUL, CATALOGUE MATERIEL MANUTAN EQUIPEMENT,,
 CMA.0036,,,, MANUTAN, 1995, 944 P EN COUL, CATALOGUE MANUTAN EQUIPEMENT INDUSTRIE MANUTENTIONNAIRE,,
 CMA.0037, EXTRAIT DU CATALOGUE GENERAL - MEMENTO 1ère EDITION 1995,,, MANUTAN, 1994, 49 P EN COUL, CATALOGUE MATERIEL EQUIPEMENT INDUSTRIE MANUTAN,,
 CM.0038,,,, OSI EXPORT, 1994, 1016 P EN COUL, CATALOGUE EQUIPEMENT LABORATOIRE,,
 DIV.001, ETUDE DIAGNOSTIQUE DE L'ORGANISATION DE LA SONABHY,,, ACECA INTERNATIONAL," Avril, 1995", Mult pag, AUDIT SONABHY GESTION,,
 DIV.002, ORGANISATION DE LA SONABHY,, RAPPORT DEFINITIF, ACECA INTERNATIONAL, 1995, 31 P, AUDIT SONABHY GESTION,,
 DIV.003, RECOMMANDATIONS SUR LE CONTROLE INTERNE - EXERCICE CLOS LES 31/12/1998 ET 31/12/1999,,, FIDUTEC, 2001, 45 P, GESTION SONABHY AUDIT,,
 DIV.004,,,, FIDUTEC, 2001, 66 P, AUDIT SONABHY GESTION FINANCE,,
 DIV.005,,,, ASSOCIATION LE TOCSIN, 2000, 14 P ; ill en coul + Annexes, RAPPORT VOYAGE SOCIETE CIVILE ASSOCIATION LE TOCSIN, BURKINA FASO,
 DIV.006,," N'GUESSAN, Olivier Patrick",, SCOR, 2000, 34 P; ill + Annexes, VOYAGE D'ETUDE RISQUE PROFESSIONNEL INCENDIE SONABHY SECURITE DEPOT PETROLIER,,
 DIV.007, AUDIT DE L'ORGANISATION ET DES SYSTEMES DE GESTION DES RESSOURCES HUMAINES,, RAPPORT PRIVISOIRE, JPR CONSULTANTS, 2004, 119 P + ANNEXES, AUDIT GESTION RESSOURCE HUMAINE SONABHY,,
 DIV.008, RAPPORT DES COMMISSAIRES AUX," DAKIO, Kalifa OUEDRAOGO, Joseph",, SONABHY, SD, 16 P + ANNEXES, GESTION FINANCE COMPTE COMPTABILITE SONABHY RAPPORT,,
 DIV.009, RAPPORT DES COMMISSAIRES AUX," DAKIO, Kalifa OUEDRAOGO, Joseph",, SONABHY, SD, 12 P, RAPPORT GESTION FINANCE COMPTABILITE SONABHY,,
 DIV.010, RAPPORT DES COMMISSAIRES AUX," DAKIO, Kalifa OUEDRAOGO, Joseph",, SONABHY, SD, 15 P, RAPPORT COMPTABILITE FINANCE GESTION SONABHY,,
 DIV.011, GESTION DES MAGASINS DE FOURNITURES SPECIFIQUES DE LA SONABHY,, RAPPORT PROVISOIRE, ACECA INTERNATIONAL, 2000, 82 P, GESTION SONABHY MAGASIN,,
 DIV.012," AUDIT DES COMPTES - EXERCICE 1999, 2000 2001 ; RAPPORT SUR LA PERTINENCE ET L'APPLICATION DU SYSTEME DE CONTROLE INTERNE EN PLACE",, RAPPORT SUR LA PERTINENCE ET L'APPLICATION DU SYSTEME DE CONTROLE INTERNE EN PLACE, FIDUCIAIRE AUDIT AFRIQUE (FAA), SD, 52 P, AUDIT COMPTES COMPTABILITE GESTION CONTROLE INTERNE,,
 DIV.013, RAPPORT FINAL SUR L'ELABORATION DE LA STRATEGIE DE COMMUNICATION ET LA SENSIBILISATION,,, MMCE, 2003, 109 P, COMMUNICATION ENERGIE, BURKINA FASO,
 DIV.014, AUDIT DE GESTION,,, MCAP, 1984, 78 P, AUDIT GESTION HYDROCARBURE SEB COMPTABILITE, BURKINA FASO,
 ETU.0003,, SANOGO Idrissa,," Institut Universitaire de Technologie (IUT) SANOGO, Idrissa", 1989, 53 P + Annexes, Stage Etude Formation Ccomptabilité Gestion,,
 ETU.0004, Rapport de formation, BOUDA Georges, Formation effectuée du 29 Août AU 12 Septembre 1999 ; Et du 21 Septembre AU 1er Octobre 1999 à G N S INTERNATIONAL ABIDJAN (RCI)," BOUDA, Georges", 1999, 35 P, Formation Informatique, COTE D'IVOIRE,
,,,,,,,,,
 ETU.0034, RAPPORT DE STAGE, BARRY Djénéba Chantal, STAGE EFFECTUE DU 1er OCTOBRE AU 30 NOVEMBRE 2005," BARRY, Djénéba Chantal INSTITUT SUPERIEUR DES FILIERES PROFESSIONNALISANTES (ISFP)", 2005, 66 P, STAGE ETUDE FORMATION SECRETARIAT GESTION COURRIER,,
 ETU.0035,, OUATTARA Fousséni, STAGE EFFECTUEE DU 1er AVRIL AU 31 MAI 2005," OUATTARA, Fousséni INSTITUT UNIVERSITAIRE DE TECHNOLOGIE", 2003, 6 P, AUDIT FINANCE COMPTE COMPTABILITE GESTION,,
 DIV.016,,,, FAA, 2003, 35 P, COMPTE AUDIT GESTION FINANCE COMPTABILITE,,
 DIV.017,,,, FAA, 2003, 6 P, AUDIT COMPTE COMPTABILITE GESTION FINANCE,,
 DIV.018,,,, FAA, 2003, 37 P, COMPTE COMPTABILITE GESTION AUDIT FINANCE,,
 DIV.019,,,, FAA, 2003, 6 P, COMPTABILITE GESTION FINANCE RAPPORT AUDIT COMPTE,,
 DIV.020,,,, FAA, 2003, 38 P, FINANCE GESTION COMPTABILITE AUDIT COMPTE,,
 DIV.021," AUDIT DES COMPTES - EXERCICE 1999, 2000,",,, FAA, 2003, 60 P, AUDIT GESTION COMPTABILITE FINANCE CONTROLE INTERNE,,
 DIV.0022, RAPPORT SUR LES DIFFERENTS PLANS COMPTABLES DE LA SEB ET DE LA SEBHY,,, SEB, 1987, MULT. PAG, COMPTABILITE SEB SEBHY GESTION FINANCE,,
 DIV.023, RAPPORT DE LA 2è EDITION DES JOURNEES PROVINCIALES DU PORC ET DU DINDON,, LES 22 ET 23 DECEMBRE 2004, ADPES, 2004, 12 P, PORC DINDON ELEVAGE ANIMAL ASSOCIATION ADPES, SANGUIE BURKINA FASO,
 DIV.024,,," DANO LES 29, 30 AVRIL ET 01 MAI 2005", GRAAD, 2005, 18 P, ART VESTIMENTAIRE VETEMENT JAVEST CULTURE ACTIVITE CULTURELLE ART, DANO BURKINA FASO,
 DIV.025, TERMES DE REFERENCE POUR L'ORGANISATION DE LA 3è EDITION DES JOURNEES DU PORC ET DU DINDON A REO LES 9 ET 10 DECEMBRE 2005,, REO LES 9 ET 10 DECEMBRE 2005, ADPES, 2005,, ELEVAGE PORC ASSOCIATION JOURNEE DU PORC JOURNEE DU DINDON ANIMAL DINDON MANIFESTATION,,
 DIV.026, FICHE DE PROJET 3è EDITION DE LA JOURNEE DE L'ART VESTIMENTAIRE TRADITIONNEL (JAVEST),, DU 27 AU 30 AVRIL 2006, GRAAD, 2006, MULT PAG, JAVEST ART VETEMENT ART VESTIMENTAIRE ACTIVITE CULTURELLE, DANO BURKINA FASO,
 DIV.027,,,, ISI, 2002, 20 P, INFORMATIQUE DOCUBASE GESTION DOCUMENTAIRE LOGICIEL INFORMATIQUE DOCUMENTAIRE,,
 REP.001, REPERTOIRE DES STAGES DE FORMATION - EDITION 1989,, EDITION 1989, INSTITUT FRANCAIS DU PETROLE, 1988, 153 P, REPERTOIRE STAGE FORMATION MOTEUR PETROLE ENERGIE,,
 REP.002, REPERTOIRE DES ENTREPRISES DE BOBO-DIOULASSO ET BANFORA,,, CCIA, 1993, 97 P, REPERTOIRE ENTREPRISE COMMERCE INDUSTRIE ARTISANAT,,
 REP.003,,,, MINISTER DE LA COMMUNICATION ET DE LA CULTURE, 1998, 191 P, REPERTOIRE POLITIQUE ADMINISTRATION ECONOMIE PUBLICITE ZAMA PUBLICITE,,
 REP.004, REPERTOIRE NATIONAL DES STATIONS DU BURKINA FASO,,, MINISTERE DE L'ENERGIE ET DES MINES, 1999, 19 P, REPERTOIRE STATION HYDROCARBURE MEM REPERTOIRE NATIONAL STATION SERVICE, BURKINA FASO,
 REP.005, REPERTOIRE DES STATIONS SERVICE DE LA ZONE DE DESSERTE DE BOBO-DIOULASSO,,, SONABHY BOBO, 1999, NO PAG, REPERTOIRE STATION STATION SERVICE HYDROCARBURE, BOBO-DIOULASSO,
 REP.006, REPERTOIRE NATIONAL DES STATIONS DE PRODUITS PETROLIERS DU BURKINA FASO,, CAPACITE, MMCE, 2001, 11 P, REPERTOIRE STATION STATION SERVICE REPERTOIRE NATIONAL STOCKAGE CAPACITE STATION PETROLE CONDITIONNEMENT,,
 CED.001, CATALOGUE DES FORMATIONS 1997,,, CENTRE TECHNIQUE DE L'APAVE, 1996, 200 P en coul, CATALOGUE FORMATION,,
,,,,, 2005, 51 P, STAGE ETUDE FORMATION COMPTABILITE GESTION FINANCE,,
 ETU.0036,, HETIE Bassanéba Awa, STAGE EFFECTUE DU 15 OCTOBRE AU 15 DECEMBRE 2005," HETIE, Bassanéba Awa INSTITUT SUPERIEUR D'INFORMATIQUE ET DE GESTION (ISIG)", 2005, 66 P, STAGE ETUDE FORMATION COMPTABILITE GESTION FINANCE IMMOBILISATION,,
 CED.002, CATALOGUE DES FORMATIONS 1998,,, CENTRE TECHNIQUE DE L'APAVE, 1997, 198 P en coul, CATALOGUE FORMATION,,
 CED.003, CATALOGUE DES FORMATIONS - EDITION 1998-2000,,, INSTITUT INDUSTRIEL DE L'AFRIQUE DE L'OUEST (IIAO), 1997, NO PAG, FORMATION CATALOGUE,,
 CED.004, CATALOGUE GENERAL 1992,,, LES EDITIONS D'ORGANISATION, 1991, 304 P, CATALOGUE FORMATION GESTION COMPTABILITE,,
 CED.005," CATALOGUE DES LIVRES ET PERIODIQUES PARUS EN 1998, 1999 et 2000",,, LA DOCUMENTATION FRANCAISE, 2001, 250 P, CATALOGUE ECONOMIE DROIT SOCIETE FORMATION,,
 CED.006,,,, GROUPE REVUE FIDUCIAIRE, SD, 83 P, CATALOGUE MULTIMEDIA FORMATION INFORMATIQUE,,
 CED.007,,,, GROUPE REVUE FIDUCIAIRE, SD, 57 P, CATALOGUE EDITION FORMATION MUMTIMEDIA INFORMATIQUE,,
 CED.008, CATALOGUE 2002,,, GROUPE REVUE FIDUCIAIRE, 2001, 72 P, CATALOGUE EDITION FORMATION ENTREPRISE,,
 CED.009, CATALOGUE GENERAL 2004,,, LA DOCUMENTATION FRANCAISE, 2003, 235 P, CATALOGUE FORMATION ECONOMIE,,
 CED.010, CATALOGUE GENERAL 2005,,, LA DOCUMENTATION FRANCAISE, 2004, 200 P, CATALOGUE FORMATION ECONOMIE,,
 ETU.0067, RAPPORT DE FIN DE CYCLE," BANGAGNE, Hosseyn", STAGE EFFECTUE DU 15 JUILLET AU 15 SEPTEMBRE 2008," BANGAGNE, Hosseyn", 2008, 64 P, STAGE FORMATION ETUDE GESTION STOCKS COMPTABILITE FINANCE,,
 ETU.0068, RAPPORT DE STAGE DE FIN DE CYCLE," GO, Paul Dilawa", STAGE EFFECTUE DU 16 AVRIL AU 15 JUIN 2007 POUR L'OBTENTION DU DIPLOME UNIVERSITAIRE DE TECHNOLOGIE (DUT)," GO, Paul Dilawa", 2007, 55 P, GESTION FINANCE STAGE FORMATION COMPTABILITE RESSOURCE HUMAINE ETUDE PERSONNEL,,
 ETU.0069, RAPPORT DE STAGE DE FIN DE CYCLE," BASSOLE, Bérenger", STAGE EFFECTUE DU 01 AOUT AU 30 SEPTEMBRE 2008 POUR L'OBTENTION DU DIPLOME UNIVERSITAIRE DE TECHNOLOGIE (DUT)," BASSOLE, Bérenger", 2008, 46 P + ANNEXES, STAGE ETUDE FORMATION FINANCE COMPTABILITE STOCKS GESTION,,
 ETU.0070, RAPPORT DE STAGE," TAMINI, Bruno", STAGE EFFECTUE DU 09 FEVRIER AU 09 AVRIL 2009 POUR L'OBTENTION DU BACCALAUREAT PROFESSIONNEL," TAMINI, Bruno", 2009, 53 P + ANNEXES, BUREAUTIQUE COMPTABILITE STAGE FORMATION ETUDE GESTION ACTIVITE PROFESSIONNELLE,,
 ETU.0071, RAPPORT DE STAGE DE FIN DE CYCLE," GNINASSE, Moumouni", STAGE EFFECTUE DU 10 FEVRIER AU 10 AVRIL 2009 A LA CAISSE NATIONALE DE SECURITE SOCIALE DE BOBO POUR L'OBTENTION DU BAC PRO BUREAUTIQUE COMPTABILITE," GNINASSE, Moumouni", 2009, 53 P, STAGE ETUDE COMPTABILITE PRESTATION FAMILIALE ACCIDENT MALADIE ASSURANCE CONTENTIEUX,,
 ETU.0072, RAPPORT DE STAGE DE FIN DE CYCLE," KABA, Baba", STAGE EFFECTUE DU 10 FEVRIER AU 10 AVRIL 2009 A LA CNSS DE BOBO," KABA, Baba", 2009, 59 P + ANNEXES, STAGE FORMATION ETUDE COMPTABILITE BUREAUTIQUE ACTIVITE PROFESSIONNELLE,,
 ETU.0073, RAPPORT DE STAGE DE FIN DE CYCLE," TINGUERIE, Kanama Clémence", STAGE EFFECTUE DU 15 FEVRIER AU 15 AVRIL 2009 pour l'obtention du BAC PRO Bureautique Comptabilité," TINGUERIE, Kanama Clémence", 2009, 39 P + ANNEXES, STAGE FORMATION ETUDE ACTIVITE PROFESSIONNELLE BUREAUTIQUE COMPTABILITE,,
 CMA.O039, CATALOGUE - EDITION 2008,, TOUT POUR LE BUREAU - PLUS DE 250 PAGES D2DI2ES AU BUREAU, MANUTAN, 2008, 256 P, CATALOGUE MANUTAN FOURNITURE DE BUREAU MOBILIER DE BUREAU,,
 CMA.0040, CATALOGUE 2008,, MANUTENTION - STOCKAGE, MANUTAN, 2008, 224 P, STOCKAGE RANGEMENT CLASSEMENT RAYONNAGE MANUTENTION CATALOGUE,,
 BUD.0062, Avant projet de budget exercice 2005,,, SONABHY BOBO, Novembre 2004, 23 P, Budget Finance Comptabilité INVESTISSEMENT Gestion CHARGE SONABHY BOBO,,
 BUD.0063, Avant projet de budget 2006,,, SONABHY BOBO, Octobre 2005, 22 P, Budget Gestion Finance CHARGE INVESTISSEMENT Comptabilité,,
 ETU.0037, RAPPORT DE STAGE, BALIMA Sylvie, STAGE EFFECTUE DU 1er FEVRIER AU 31 MARS 2006," BALIMA, Sylvie Etablissement Scolaire Polyvalent Assomption de KOUDOUGOU (ESPAK)", 2006, 61 P, STAGE ETUDE FORMATION COMPTABILITE FINANCE BUREAUTIQUE,,
 ETU.0038, DOSSIER PROFESSIONNEL POUR L'OBTENTION DU BACCALAUREAT, BAKOI Nadège, STAGE EFFECTUE DU 1er FEVRIER AU 31 MARS 2006," BAKOI, Nadège Etablissement Scolaire Polyvalent Assomption de KOUDOUGOU (ESPAK)", 2006, 47 P, STAGE ETUDE Finance Budget CHRAGE INVESTISSEMENT,,
 BUD.0065, PROJET DE BUDGET EXERCICE 2005,,, SONABHY OUAGA, 2004, 65 P + ANNEXES, GESTION FINANCE COMPTABILITE BUDGET INVESTISSEMENT,,
 BUD.0066, PROJET DE BUDGET EXERCICE 2006,,, SONABHY OUAGA, 2005, 63 P + ANNEXES, GESTION FINANCE COMPTABILITE BUDGET INVESTISSEMENT,,
 BUD.0067, BUDGET - EXERCICE 2005,,, SONABHY OUAGA, 2004, 65 P + ANNEXES, GESTION COMPTABILITE FINANCE BUDGET,,
 BUD.0068, BUDGET - EXERCICE 2006,,, SONABHY OUAGA, 2005, 62 P + ANNEXES, GESTION FINANCE COMPTABILITE BUDGET,,
 BUD.0069, BUDGET - EXERCICE 2007,,, SONABHY OUAGA, JANVIER 2007, 65 P, GESTION COMPTABILITE FINANCE BUDGET,,
 BUD.0070, BUDGET - EXERCICE 2007,,, SONABHY OUAGA, JANVIER 2007, 65 P, FINANCE COMPTABILITE GESTION BUDGET,,
 BUD.0071, BUDGET - EXERCICE 2008,,, SONABHY OUAGADOUGOU, DECEMBRE 2007, 59 P, GESTION FINANCE COMPTABILITE BUDGET,,
 BUD.0072, RAPPORT D'EXECUTION DU BUDGET AU 30 JUIN 2005,,, SONABHY  OUAGA, OCTOBRE 2005, 35 P, GESTION COMPTABILITE FINANCE BUDGET EXECUTION BUDGETAIRE,,
 BUD.0073, RAPPORT D'EXECUTION DU BUDGET AU 31 MARS 2006,,, SONABHY OUAGA, AOUT 2006, 33 P + ANNEXES, FINANCE GESTION COMPTABILITE BUDGET EXECUTION BUDGETAIRE,,
 BUD.0074, RAPPORT D'EXECUTION BUDGETAIRE AU 31 MARS 2004,,, SONABHY BOBO, 2004, 15 P, FINANCE GESTION COMPTABILITE BUDGET EXECUTION BUDGETAIRE,,
 BUD.0075, RAPPORT D'EXECUTION BUDGETAIRE AU 31 MARS 2005,,, SONABHY BOBO, 2005, 11 P, FINANCE GESTION COMPTABILITE BUDGET EXECUTION BUDGETAIRE,,
 BUD.0076, RAPPORT D'EXECUTION BUDGETAIRE AU 30 JUIN 2005,,, SONABHY BOBO, 2005, 14 P, FINANCE COMPTABILITE GESTION BUDGET EXECUTION BUDGETAIRE,,
 BUD.0077, RAPPORT D'EXECUTION BUDGETAIRE AU 31 SEPTEMBRE 2005,,, SONABHY  BOBO, 2005, 12 P, FINANCE GESTION COMPTABILITE BUDGET EXECUTION BUDGETAIRE,,
 BUD.0078, RAPPORT D'EXECUTION BUDGETAIRE AU 31 DECEMBRE 2005,,, SONABHY BOBO, 2006, 11 P, GESTION FINANCE COMPTABILITE BUDGET EXECUTION BUDGETAIRE,,
 BUD.0079, RAPPORT D'EXECUTION BUDGETAIRE AU 31 MARS 2006,,, SONABHY BOBO, 2006, 12 P, GESTION COMPTABILITE FINANCE BUDGET EXECUTION BUDGETAIRE,,
 BUD.0080, RAPPORT D'EXECUTION BUDGETAIRE AU 30 JUIN 2006,,, SONABHY BOBO, 2006, 12 P, GESTION COMPTABILITE FINANCE BUDGET EXECUTION BUDGETAIRE SONABHY BOBO,,
 BUD.0081, RAPPORT D'EXECUTION BUDGETAIRE AU 30 SEPTEMBRE 2006,,, SONABHY  BOBO," Octobre, 2006", 12 P, GESTION FINANCE COMPTABILITE BUDGET EXECUTION BUDGETAIRE,,
 BUD.0082, RAPPORT D'EXECUTION BUDGETAIRE AU 31 DECEMBRE 2006,,, SONABHY BOBO, Février 2007, 11 P, GESTION FINANCE COMPTABILITE EXECUTION BUDGETAIRE BUDGET,,
 BUD.0083, RAPPORT D'EXECUTION BUDGETAIRE AU 31 MARS 2007,,, SONABHY BOBO," Avril, 2007", 12 P, GESTION COMPTABILITE FINANCE BUDGET EXECUTION BUDGETAIRE SONABHY BOBO,,
 BUD.0084, RAPPORT D'EXECUTION BUDGETAIRE AU 30 JUIN 2007,,, SONABHY BOBO," Juillet, 2007", 11 P, GESTION BUDGET COMPTABILITE FINANCE EXECUTION BUDGETAIRE,,
 BUD.0085, RAPPORT D'EXECUTION BUDGETAIRE AU 30 SEPTEMBRE 2007,,, SONABHY BOBO, 2007, 11 P, GESTION BUDGET COMPTABILITE FINANCE EXECUTION BUDGETAIRE SONABHY BOBO,,
 BUD.0086, RAPPORT D'EXECUTION BUDGETAIRE AU 30 JUIN 2008,,, SONABHY BOBO," Juillet, 2008", 11 P, GESTION COMPTABILITE FINANCE BUDGET EXECUTION BUDGETAIRE SONABHY BOBO,,
,,,,,,,,,
 ETU.0039, RAPPORT DE STAGE, OUEDRAOGO Ahmadou, STAGE EFFECTUE DU 20 FEVRIER AU 20 AVRIL 2006," OUEDRAOGO, Ahmadou LYCEE PROFESSIONNEL DE BOBO (LPB)", 2006, 55 P, STAGE ETUDE FORMATION COMPTABILITE BUREAUTIQUE FINANCE,,
 BUD.0087, RAPPORT D'EXECUTION BUDGETAIRE AU 30 SEPTEMBRE 2008, OUEDRAOGO Etienne Pègrébénéwendé, STAGE EFFECTUE DU 20 FEVRIER AU 20 AVRIL 2006 A LA SONAR, SONABHY BOBO, 2008, 11 P, GESTION COMPTABILITE FINANCE BUDGET EXECUTION BUDGETAIRE,,
 BUD.0088, RAPPORT D'EXECUTION BUDGETAIRE AU 31 DECEMBRE 2008,,, SONABHY BOBO, 2009, 9 P, GESTION COMPTABILITE FINANCE BUDGET EXECUTION BUDGETAIRE SONABHY BOBO,,
 AMC.0042, GUIDE PRATIQUE DE LA GESTION,, COMMENT DEFINIR LA GESTION D'ENTREPRISE ; L'ENTREPRISE ET LE CIRCUIT ECONOMIQUE ; DISTINCTION ET CLASSIFICATION DES ENTREPRISES, EDITIONS SCIENCES ET TECHNIQUES, 1987, 25 P, ENTREPRISE GESTION ECONOMIE MANAGEMENT COMPTABILITE CIRCUIT ECONOMIQUE CLASSIFICATION DES ENTREPRISES,,
 AMC.0043, GUIDE PRATIQUE DE LA GESTION,,, EDITONS SCIENCES ET TECHNIQUES, 1987, 76 P + EXTENSION 33 P, MANAGEMENT COMPTABILITE BILAN ENTREPRISE AMORTISSEMENT GESTION ECONOMIE COMPTE,,
 AMC.0044, GUIDE PRATIQUE DE LA GESTION,,, EDITIONS SCIENCES ET TECHNIQUES, 1987, 60 P + EXTENSION 30 P, COMPTABILITE MANAGEMENT GESTION ECONOMIE CHARGE,,
 AMC.0045, GUIDE PRATIQUE DE LA GESTION,,, EDITIONS SCIENCES ET TECHNIQUES, 1987, 160 P, GESTION COMPTABILITE MANAGEMENT BUDGET PROCEDURE BUDGETAIRE BUDGETISATION CONTROLE BUDGETAIRE ENTREPRISE ECONOMIE,,
 AMC.0046, GUIDE PRATIQUE DE LA GESTION,,, EDITIONS SCIENCES ET TECHNIQUE, 1987, 92 P + EXTENSION 21 P, MANAGEMENT COMPTABILITE GESTION ENTREPRISE ECONOMIE COMPTE BILAN GESTION D'ENTREPRISE,,
 AMC.0047, GUIDE PRATIQUE DE LA GESTION,,, EDITIONS SCIENCES ET TECHNIQUES, 1987, 81 P + EXTENSION 17 P, COMPTABILITE GESTION MANAGEMENT ECONOMIES ENTREPRISE FINANCE FINANCEMENT,,
 AMC.0048, LA GESTION DES STOCKS,,, EDITIONS SCIENCES ET TECHNIQUES, 1987, 78 P, GESTION ECONOMIE FINANCE COMPTABILITE MANAGEMENT ENTREPRISE GESTION D'ENTREPRISE STOCKS,,
 AMC.0049, GUIDE PRATIQUE DE LA GESTION,,, EDITIONS SCIENCES ET TECHNIQUES, 1987, 82 P + EXTENSION 15 P, GESTION ENTREPRISE GESTION D'ENTREPRISE COMPTABILITE MANAGEMENT STOCKS,,
 AMC.0050, GUIDE PRATIQUE DE LA GESTION,,, EDITIONS SCIENCES ET TECHNIQUES, 1987, 70 P, MANAGEMENT COMPTABILITE GESTION ENTREPRISE GESTION D'ENTREPRISE INVESTISSEMENT,,
 AMC.0051, GUIDE PRATIQUE DE LA GESTION,,, EDITIONS SCIENCES ET TECHNIQUES, 1987, 56 P + EXTENSION 20 P, MANAGEMENT COMPTABILITE GESTION ENTREPRISE GESTION DE PROJET,,
 ACT.0040, Rapport d'activité 2007,,, SONABHY OUAGA, Avril 2008, 92 P + Annexes, Comptabilité Gestion Activité,,
 ACT.0041, Rapport d'activité - Année 2004,,, SONABHY BOBO, 2005, 40 P, Activité Gestion Finance Comptabilité SONABHY BOBO,,
 ACT.0042, Rapport d'activité - Année 2006,,, SONABHY BOBO, 2007, 43 P, Gestion Finance Comptabilité SONABHY BOBO Activité,,
 ACT.0043, Rapport d'activité - Année 2007,,, SONABHY BOBO, 2008, 46 P, Gestion Finance Comptabilité Activité SONABHY BOBO,,
 BIL.0019, BILAN AU 31 DECEMBRE 1998,,, SOFIDEC OUAGA, 30 AVRIL 1999, 25 P, BILAN FINANCE GESTION COMPTABILITE,,
 BIL.0020, BILAN 2006,,, SONABHY OUAGA, MARS 2007, MULTIPLES PAGES, GESTION BILAN COMPTABILITE FINANCE SONABHY,,
 BUD.0089, Avant projet de budget Exercice 1989,,, SONABHY BOBO, 1988, 49 P + Annexes, Budget Gestion Comptabilité Finance INVESTISSEMENT,,
 BUD.0090, RAPPORT D'EXECUTION BUDGETAIRE AU 31 DECEMBRE 2007,,, SONABHY BOBO," Février, 2008", 10 P, BUDGET EXECUTION BUDGETAIRE RAPPORT DE BUDGET GESTION FINANCE COMPTABILITE IMMOBILISATION,,
 ETU.074 SONAR LYCEE PROFESSIONNEL DE BOBO (LPB),,,,, 2006, 60 P, STAGE ETUDE FORMATION ASSURANCE VIE COMPTABILITE,,
 ETU.0041, RAPPORT DE STAGE, OUATTARA B. Fadila Simbel, STAGE EFFECTUE DU 20 FEVRIER AU 20 AVRIL 2006," OUATTARA, B. Fadila Simbel LYCEE PROFESSIONNEL DE BOBO (LPB)", 2006, 41 P, STAGE ETUDE FORMATION COMPTABILITE FINANCE,,
 ETU.0042, Rapport de fin de cycle," TRAORE, Djéléfanga Serge", Stage effectué du 03 au 30 novembre 2000 pour l'obtention du BTS et du DTS Comptabilité et Gestion des entreprises," TRAORE, Djéléfanga Serge", 2001, 42 P + Annexes, Stage Formation Comptabilité Gestion des entreprises Finance Gestion,,
 ETU.0075, Rapport de stage de fin de cycle," ROAMBA, Youssouf", Stage effectué du 23 Juillet au 23 Septembre 2001 pour l'obtention du DUT Finance Comptabilité," ROAMBA, Youssouf", 2001, 50 P + Annexes, Finance Comptabilité Stage Formation Comptabilité analytique Gestion,,
 ETU.0076, Rapport de stage de fin de cycle," FARMA, Siété Drissa Samuel", Stage effectué du 1er Août au 30 Septembre 2001 pour l'obtention du DUT Finance Comptabilité," FARMA, Siété Drissa Samuel", 2001, 61 P + Annexes, Stage Formation Finance Rapport d'étude Gestion Comptabilité Gestion des stocks,,
 ETU.0077, Rapport de stage de fin de cycle," KAGONE, Haoua", Stage effectué du 09 Août au 25 Septembre 2001 pour l'obtention du BEP Administration Commerciale et Comptable Informatique," KAGONE, Haoua", 2001, 40 P + Annexes, Stage Formation Gestion Commerce Comptabilité Comptabilité Etude Finance,,
 ETU.0078, RAPPORT DE STAGE DE FIN DE CYCLE," KABORE, Jacqueline", STAGE EFFECTUE DU 1ER FEVRIER AU 31 MARS 2006 POUR L'OBTENTION DU BTS FINANCE COMPTABILITE," KABORE, Jacqueline", 2006, 80 P + ANNEXES, STAGE FORMATION STAGE COMPTABILITE FINANCE GESTION ETUDE IMMOBILISATION CORPORELLE,,
 ETU.0079, RAPPORT DE STAGE DE FIN DE CYCLE," ZOUNGRANA, A. Rahamane", STAGE EFFECTUE DU 1ER FEVRIER AU 31 MARS 2007 A LA CNSS POUR L'OBTENTION DU BAC PRO," ZOUNGRANA, A. Rahamane", 2007, 45 P + ANNEXES, STAGE FORMATION STAGE BUREAUTIQUE COMPTABILITE GESTION FINANCE,,
 ETU.080, DOSSIER DE FORMATION EN MILIEU PROFESSIONNEL," TUINA, Charles", STAGE EFFECTUE DU 1ER FEVRIER AU 31 MARS 2007 A LA DIRECTION REGIONALE DE L'ENSEIGNEMENT DE BASE DES HAUTS BASSINS POUR L'OBTENTION DU BAC PRO," TUINA, Charles", 2007, 41P + ANNEXES, FORMATION STAGE ETUDE BUREAUTIQUE COMPTABILITE ENSEIGNEMENT EDUCATION, HAUTS-BASSINS,
 ETU.081, RAPPORT DE STAGE DE FIN DE CYCLE," KABORE, W. Jeannette", STAGE EFFECTUE DU 06 FEVRIER AU 07 AVRIL 2007 A LA RAN HOTEL SOMKETA POUR L'OBTENTION DU BAC PRO, KABORE W. Jeannette, 2007, 41P + ANNEXES, STAGE HOTELERIE GESTION COMPTABILITE FORMATION ETUDE RAN HOTEL SOMKETA,,
