COTE DE RANGEMENT,TITRE,AUTEURS PERS. PHYS.,NOTE,EDITEUR,DATE EDITION,COLLATION,MOTS CLES MATIERES,MOTS CLES GEO,OBSERVATIONS
 ETU.0001, Rapport de stage, OUEDRAOGO Hamadé Dhé, Assistant du Chef Exploitation," OUEDRAOGO, Hamadé Dhé", 1980, 23 P, Stage Etude Formation Exploitation Dépôt pétrolier Hydrocarbure,,
 ETU.0002, Rapport de stage, OUEDRAOGO Hamadé Dhé, Stage effectué à LOME (TOGO)," OUEDRAOGO, Hamadé Dhé", 1980, 9 P, Stage Formation Etude Dépôt pétrolier Hydrocarbure, TOGO,
,,,,,, 40 P + ANNEXES, STAGE ETUDE FORMATION TABAC MABUCIG COMPTABILITE GESTION,,
 ETU.0018,, ZONGO Marie Denise, STAGE EFFECTUE DU 15 AOUT AU 15 OCTOBRE 2002," ZONGO, Marie Denise ECOLE SUPERIEURE DES SCIENCES APPLIQUEES (ESSA)", 2002, 55 P, STAGE ETUDE FORMATION COMPTABILITE COMPTABILITE GESTION FINANCE GESTION STOCKS,,
 ETU.0019,," REIX, Robert",, BORDAS, 1984, 303 P, COMPTABILITE GESTION INFORMATIQUE SYSTEME INFORMATIQUE ENTREPRISE,,
 AMC.0021,," ZERMATI, Pierre",, BORDAS, 1984, 146 P, GESTION STOCKS COMPTABILITE,,
 AMC.0022,,,,,,,,,
 AMC.0023,," MORIN, Pierre",, BORDAS, 1984, 209 P, COMMANDE GESTION COMPTABILITE ORGANISATION MANAGEMENT,,
 AMC.0024,," BRIDIER, Manuel MACHA+LOF, Serge",, BORDAS, 1984, 264 P, GESTION PROJET ANALYSE DE PROJET COMPTABILITE MANAGEMENT ECONOMIE INVESTISSEMENT,,
 AMC.0025, Tarif des Douanes,,, CEAO, SD, Mult Pag + Barême, Tarif Douane Management Barême Frais de bord Tarif Droit et taxe Tarif importation, CEAO HAUTE VOLTA,
 AMC.0026,,,, EDITIONS FRANCIS LEFEBVRE, 1983, 1212 P, MEMENTO FISCALITE COMPTABILITE DROIT FISCAL,,
 AMC.0027, FORMATION DES OPERATEURS ECONOMIQUES SUR LA TVA,,, DGI, SD, 47 P, DIRECTION GENERALE DES IMPORTS IMPOT TVA COMPTABILITE FORMATION ECONOMIE,,
 AMC.0028, PLAN DE COMPTES SYSCOA,,, SONABHY OUAGA, 2002, 28 P + MULT PAG, COMPTE COMPTABILITE PLAN COMPTABLE GESTION MANAGEMENT SYSCOA,,
 AMC.0029, GESTION DES MAGASINS DE FOURNITURES SPECIFIQUES,,, ACECA INTERNATIONAL, 2001, 98 P, GESTION COMPTABILITE AUDIT COMPTES,,
 AMC.0030, REORGANISATION DE LA GESTION DES,,, SOFIDEC, 2000, MULT PAG, IMMOBILISATION GESTION COMPTABILITE SONABHY MANAGEMENT,,
 AMC.0031, REORGANISATION DE LA GESTION DES,,, SOFIDEC, 2000, MULT PAG, GESTION COMPTABILITE IMMOBILISATION MANAGEMENT SONABHY BOBO,,
 AMC.0032, REORGANISATION DE LA GESTION DES,,, SOFIDEC, 2000, MULT PAG, GESTION COMPTABILITE ANAGEMENT IMMOBILISATION SONABHY BOBO,,
 AMC.0033, PLAN COMPTABLE SEB,,, SEB, 1987, 17 P, COMPTABILITE GESTION ADMINISTRATION MANAGEMENT,,
 AMC.0034, PLAN COMPTABLE SEBHY,,, SEBHY, 1987, 8 P, GESTION COMPTABILITE ADMINISTRATION MANAGEMENT SEBHY,,
 AMC.0035, PLAN COMPTABLE,,, SEB, 1974, 73 P, GESTION COMPTABILITE MANAGEMENT SEB,,
 AMC.0036, LES SYSTEMES DE GESTION DE LA SONABHY,,, TIME INFORMATIQUE, SD, Mult Pag, SYSTEME GESTION SONABHY INFORMATIQUE MANAGEMENT COMPTABILITE,,
 AMC.0037," NOTICE D'UTILISATION DES DECLARATIONS EN DOUANE EN PROCEDURE INFORMATISEE ""SYDONIA""",,, DIRECTION GENERALE DES DOUANES, SD, Mult. Pag, DOUANE INFORMATIQUE GESTION MANAGEMENT DECLARATION SYDONIA DOUANE,,
 AMC.0038, AUDIT DES COMPTES DES EXERCICES 1999-2000 ET 2001,, PROJET DE RAPPORT SUR LA PERTINENCE ET L'APPLICATION DU SYSTEME DE CONTROLE INTERNE EN PLACE (AVIS ET OBSERVATIONS DE LA SONABHY), SONABHY OUAGA, 2003, 20 P, COMPTABILITE GESTION AUDIT COMPTE CONTROLE INTERNE FIDUCIAIRE AUDIT AFRIQUE (FAA) PRIVATISATION SONABHY,,
 AMC.0039, AUDIT DES COMPTES DE LA SONABHY - EXERCICES 1999-2000 ET 2001 (PROJET),, RAPPORT SUR LA REVUE DU CONTROLE INTERNE, FIDUCIAIRE AUDIT AFRIQUE (FAA), 2003, 52 P, CONTROLE INTERNE COMPTABILITE GESTION COMPTE AUDIT FIDUCIAIRE AUDIT AFRIQUE (FAA) PRIVATISATION SONABHY,,
 BIL.0001,, KABEROU Harouna, STAGE EFFECTUE DU 2 NOVEMBRE AU 31 DECEMBRE 2004," KABEROU, Harouna ECOLE SUPERIEURE DES SCIENCES APPLIQUEES (ESSA)", 2004, 55 P, STAGE ETUDE FORMATION COMPTABILITE GESTION TRESORERIE FINANCE,,
 ETU.0020,, KY Joël, STAGE EFFECTUE DU 1er SEPTEMBRE AU 30 OCTOBRE 2005, SEB, 1987, 97 P, BILAN FINANCE COMPTABILITE GESTION SEB,,
 BIL.0002, BILAN AU 31 DECEMBRE 1986,,, SONABHY OUAGA, 1989, 140 P, BILAN GESTION COMPTABILITE SONABHY FINANCE,,
 BIL.0003, BILAN AU 31 DECEMBRE 1991,,, SONABHY OUAGA, 1992, 244 P, GESTION BILAN FINANCE COMPTABILITE SONABHY,,
 BIL.0004, BILAN AU 31 DECEMBRE 1991,,, SONABHY OUAGA, 1992, 20 P, GESTION FINANCE COMPTABILITE SONABHY,,
 BIL.0005, BILAN AU 31 DECEMBRE 1992,,, SONABHY OUAGA, 1993, 250 P, GESTION FINANCE COMPTABILITE SONABHY BILAN,,
 BIL.0006, BILAN AU 31 DECEMBRE 1993,,, SONABHY OUAGA, 1994, 20 P, GESTION BILAN COMPTABILITE FINANCE SONABHY,,
 BIL.0007, BILAN AU 31 DECEMBRE 1995,,, SONABHY OUAGA, 1996, 264 P + ANNEXES, BILAN GESTION SONABHY COMPTABILITE FINANCE,,
 BIL.0008,,,, SONABHY BOBO, 1994, 26 P, BILAN COMPTABILITE ACTIVITE DEPOT FINANCE SONABHY BOBO GESTION,,
 BIL.0009,,,, SONABHY BOBO, 1995, 36 P, GESTION COMPTABILITE BILAN SONABHY BOBO FINANCE ACTIVITE DEPOT,,
 BIL.0010,,,, SONABHY BOBO, 1996, 51 P, BILAN GESTION FINANCE COMPTABILITE SONABHY BOBO ACTIVITE DEPOT,,
 BIL.0011, BILAN AU 31 DECEMBRE 2003,,, SONABHY OUAGA, 2004, NO Pag, BILAN GESTION COMPTABILITE FINANCE SONABHY,,
 BIL.0012, BILAN AU 31 DECEMBRE 1987,,, SONABHY OUAGA, 1990, 161 P, GESTION COMPTABILITE FINANCE BILAN SONABHY,,
 BIL.0013, BILAN AU 31 DECEMBRE 1986,,, SONABHY OUAGA, 1989, 144 P, GESTION COMPTABILITE FINANCE BILAN SONABHY OUAGA,,
 BIL.0014, BILAN AU 31 DECEMBRE 1985,,, SEB, 1986, 69 P, GESTION BILAN FINANCE COMPTABILITE SEB,,
 BIL.0015, BILAN ACTIVITES DEPOT AU 31 DECEMBRE 1991,,, SONABHY BOBO, 1992, Mult Pag, GESTION BILAN FINANCE COMPTABILITE ACTIVITE DEPOT SONABHY BOBO,,
 BIL.0016, BILAN AU 31 DECEMBRE 1990,,, SONABHY OUAGA, 1991, 252 P, GESTION BILAN COMPTABILITE FINANCE SONABHY OUAGA,,
 BIL.0017, SITUATION AU 31 DECEMBRE 1982,,, SEB, 1983, Mult Pag, GESTION FINANCE COMPTABILITE SEB BALANCE IMMOBILISATION,,
 DLE.0001, DROIT DU TRAVAIL 1,,,,, 10 P, DROIT LEGISLATION TRAVAIL DROIT DU TRAVAIL,,
 DLE.0002, LE DROIT DU TRAVAIL 2,,,,, 62 P + ADDITIF, DROIT LEGISLATION DROIT DU TRAVAIL,,
 DLE.0003,,,,,, Mult Pag, DROIT LEGISLATION JURIDICTION COMMERCE,,
 DLE.0004,,,,,, Mult Pag, DROIT LEGISLATION JURIDICTION COMMERCE,,
 DLE.0005,,, TOME 1,,, Mult Pag, DROIT PENAL DROIT LEGISLATION DELIT INFRACTION JURIDICATION,,
 DLE.0006,,, TOME 2,,, 43 P + ADDITIF, DROIT LEGISLATION DELIT INFRACTION DROIT PENAL JURIDICTION,,
 DLE.0007,,, TOME 3,,, 68 P, STAGE ETUDE FORMATION BUDGET GESTION COMPTABILITE FINANCE,,
 ETU.0021,, HETIE Bassanéba Awa, STAGE EFFECTUE DU 15 OCTOBRE AU 15 DECEMBRE 2005," HETIE, Bassanéba Awa INSTITUT SUPERIEUR DE L'INFORMATIQUE ET DE GESTION (ISIG)", 2005, 68 P, STAGE ETUDE FORMATION COMPTABILITE GESTION FINANCE IMMOBILISATION,,
 ETU.0022,,,,,,,,,
 DLE.0008,,,, SCIENCES ET TECHNIQUES, 1987, 146 P, DROIT CIVIL DROIT LEGISLATION JURIDICTION MARIAGE FAMILLE REGLE SOCIETE,,
 DLE.0009,,, TOME 2,,, 109 P + COMPLEMENT, DROIT LEGISLATION DROIT CIVIL SOCIETE FAMILLE MARIAGE JURIDICTION REGLE,,
 DLE.0010,,, TOME 3,,, 103 P + COMPLEMENT, DROIT DROIT CIVIL JURIDICTION LEGISLATION MATERIEL BIENS BIEN ET SERVICE,,
 DLE.0011,,, TOME 4,,, Mult Pag, DROIT LEGISLATION DROIT CIVIL OBLIGATION JURIDICTION,,
 DLE.0012, COURS DE DROIT CIVIL 5,,,,, 44 P + CORRIGE, DROIT CIVIL DROIT SURETE CAUTION LEGISLATION JURIDICTION,,
 DLE.0013, LA DOCUMENTATION FISCALE DE LA HAUTE,, CATEGORIE DES BENEFICES INDUSTRIELS ET COMMERCIAUX, CCIA-HV, 1981, 96 P, DROIT LEGISLATION FISCALITE IMPOT COMMERCE INDUSTRIE,,
 DLE.0014, LA DOCUMENTATION FISCALE DE LA HAUTE,, 2, CCIA HV, 1982, 97 A 198 P, DROIT LEGISLATION IMPOT FISCALITE COMMERCE INDUSTRIE,,
 DLE.0015, LA DOCUMENTATION FISCALE DE LA HAUTE,,, CCIA, 1981, 199 A 334 P, DROIT LEGISLATION IMPOT FISCALITE COMMERCE,,
 DLE.0016, LA DOCUMENTATION FISCALE DE LA HAUTE,,, CCIA, 1981, 95 P, IMPOT DROIT LEGISLATION FISCALITE,,
 DLE.0017, LA DOCUMENTATION FISCALE DE LA HAUTE,,, CCIA, 1981, 96 A 181 P, DROIT LEGISLATION FISCALITE,,
 DLE.0018, LA DOCUMENTATION FISCALE DE LA HAUTE,,, CCIA, 1981, 82 P, FISCALITE DROIT LEGISLATION IMPOTS,,
 DLE.0019, LA DOCUMENTATION FISCALE DE LA HAUTE,,, CCIA, 1981, 83 A 195 P, DROIT LEGISLATION IMPOT FISCALITE,,
 DLE.0020, LA DOCUMENTATION FISCALE DE LA HAUTE,,, CCIA, 1981, 63 P, DROIT LEGISLATION FISCALITE IMPOTS PATENTE,,
 DLE.0021, MANUEL SUR LE DROIT DE TRAVAIL AU BURKINA FASO,,, CCIA, SD, 28 P, DROIT LEGISLATION TRAVAIL DROIT DU TRAVAIL, BURKINA FASO,
 DLE.0022, LE DROIT EN COTE D'IVOIRE,,, E s t, SD, Mult Pag, DROIT LEGISLATION DROIT DU TRAVAIL, COTE D'IVOIRE,
 DLE.0023, LOI N°4/92/ADP PORTANT MODIFICATION DU CODE DES IMPOTS ET INSTITUTION DE LA TAXE SUR LA VALEUR AJOUTEE (TVA),,, DGI, 1992, 37 P, DROIT LEGISLATION IMPOT FISCALITE,,
 DLE.0024, VEILLE REGLEMENTAIRE DES EXIGEANCES APPLICABLES AUX DEPOTS D'HYDROCARBURES DE LA SONABHY,,, SONABHY OUAGA, 2005, 14 P, DROIT LEGISLATION SONABHY REGLEMENTATION HYDROCARBURE DEPOT PRODUIT PETROLIER SECURITE,,
 DLE.0025, SESSION DE FORMATION EN DROIT DU TRAVAIL,,, CAJUFOR, 2000, 75 P, DROIT LEGISLATION DROIT DU TRAVAIL FORMATION,,
 DLE.0026, CONVENTION COLLECTIVE,,, SOFITEX, 2004, Mult Pag, DROIT LEGISLATION CONVENTION COLLECTIVE SOFITEX,,
 DLE.0027, TEXTES ET CONVENTIONS COLLECTIVES ET SECTORIELLES APPLICABLES AU DROIT DU TRAVAIL AU BURKINA FASO,,, CCIA, 1996, 473 P, DROIT LEGISLATION TEXTE DROIT DU TRAVAIL CONVENTION COLLECTIVE, BURKINA FASO,
 DLE.0028,, KONKOBO Juliette, STAGE EFFECTUE DU 17 OCTOBRE AU 16 DECEMBRE 2005," KONKOBO, Juliette INSTITUT SUPERIEUR D'INFORMATIQUE ET DE GESTION (ISIG)", 2005, 61 P, STAGE ETUDE FORMATION GESTION FINANCE APPROVISIONNEMENT HYDROCARBURE DESSERTE REGION DE  L'OUEST COMPTABILITE,,
 ETU.0023,, KAM Marie Laure Houmpa, STAGE EFFECTUE DU 17 OCTOBRE AU 16 DECEMBRE 2005, CCIA, SD, 446 P, DROIT LEGISLATION DROIT DU TRAVAIL, HAUTE VOLTA,
 DLE.0029,,,, A-GRH, 2004, Mult Pag, DROIT LEGISLATION CODE DU TRAVAIL GESTION RESSOURCE HUMAINE, BURKINA FASO,
 DLE.0030, LOIS - RESOLUTIONS - ANNEE 1992,,, ADP, 1992, 474 P, DROIT LEGISLATURE LOI,,
 DLE.0031, LOIS - ANNEE 1993,,, ADP, 1993, 359 P, LOI DROIT LEGISLATURE,,
 DLE.0032, GUIDE DES INCOTERMS 1990,,, CHAMBRE DE COMMERCE INTERNATIONAL (CCI), 1991, 152 P, DROIT LEGISLATION TRANSPORT,,
 DLE.0033, SESSION DE FORMATION EN DROIT DU TRAVAIL," COULIBALY, San André TRAORE, Zoumana", SUPPORT DIDACTIQUE ET EXERCICES, CAJUFOR, NOVEMBRE 1999, 57 P, DROIT LEGISLATION FORMATION DROIT DU TRAVAIL,,
 DLE.0034, SESSION DE FORMATION EN DROIT DU,,, CAJUFOR, 2000, 60 P, DROIT LEGISLATION CONFLIT CONFLIT DU TRAVAIL DROIT DU TRAVAIL GESTION DE CONFLIT,,
 DLE.0035, 1er CONGRES DU FRONT POPULAIRE LES,,, FRONT POPULAIRE, 1990, 12 P, DROIT LEGISLATION FRONT POPULAIRE PROJET DE STATUT PARTI POLITIQUE,,
 DLE.0036, INFORMATION GENERALE SUR LE DROIT DES SOCIETES COMMERCIALES ET DU GROUPEMENT D'INTERET ECONOMIQUE (GIE),,, EMERGENCE BURKINA FASO, 2005, 11 P, DROIT LEGISLATION SOCIETE COMMERCE FISCALITE,,
 DLE.0037, RECUEIL DE TEXTE PORTANT REGLEMENTATION DES SOCIETES A CAPITAUX PUBLICS,,, MCIA, 1996, 34 P, REGLEMENTATION DROIT LEGISLATION SOCITE D'ETAT,,
 DLE.0038, DICTIONNAIRE BIOGRAPHIQUE DES DEPUTES DU BURKINA FASO DE 1992-1997," BAKIONO, André", ANALYSE HISTORICO-CRITIQUE, DECOUVERTES DU BURKINA, 30 JUIN 2007, 173 P, DROIT LEGISLATION ASSEMBLEE NATIONALE DEPUTE BIOGRAPHIE, BURKINA FASO,
 DLE.0039, LOI N°031-2007-AN DU 29 NOVEMBRE 2007 PORTANT INSTITUTION D'UN CORPS DE VOLONTAIRES NATIONAUX AU BURKINA FASO,,, ASSEMBLEE NATIONALE, 29 NOVEMBRE 2007, 12 P, VOLONTAIRE VOLONTARIAT ASSEMBLEE NATIONALE DROIT LEGISLATION LOI BENEVOLA CORPS DE VOLONTAIRE VOLONTAIRE NATIONAL, BURKINA FASO,
 TEC.0001, MECANIQUE GENERALE," GAILLARD, Marcel RAAFFY, Jean Claude", TOME 2, EYROLLES, 1990, 168 P, MECANIQUE TECHNIQUE,,
 TEC.0002, AIDE MEMOIRE DE TUYAUTERIE," VALCKE, Marc",, EYROLLES, 1990, 16 P, TUYAUTERIE TECHNIQUE INDUSTRIE,,
 TEC.0003,," BLANCKAERT, L. PIRON, N.", THEME III, DUNOD, 1974, 264 P, TECHNOLOGIE TECHNIQUE AUTOMOBILE EQUIPEMENT AUTO ELECTRICITE,,
 TEC.0004, LA THERMODYNAMIQUE, CHAMBADAL P.,, EYROLLES ; DIRECTION DES ETUDES ET RECHERCHES D'ELECTRICITE DE FRANCE, 1974, 116 P, TECHNOLOGIE ELECTRICITE THERMODYNAMIQUE,,
 TEC.0005, LES METHODES D'ELEMENTS FINIS EN MECANIQUE DES FLUIDES," RAVIART, Pierre Arnaud",, EDITIONS EYROLLES, 1981, 136 P, TECHNOLOGIE MECANIQUE FLUIDE ELEMENT FINI,,
 TEC.0006, MODELISATION DES PHENOMENES DE COMBUSTION," BORGHI, R. CLAVIN, P. LINAN, A. PELCE, P. SIVASHINSKY, G. I.",, EDITIONS EYROLLES, 1985, 204 P, TECHNOLOGIE ELECTRICITE SCIENCE COMBUSTION,,
 TEC.0007,," J. E., IDEL'CIK", MEMENTO, EDITION EYROLLES, 1986, 494 P, TECHNOLOGIE ELECTRICITE INDUSTRIE,,
 TEC.0008,,,, EMCO ARPAL, SD, 23 P ; 27 P, BULLETIN INDUSTRIE TECHNIQUE TECHNOLOGIE TEMPERATURE METAL,,
 TEC.0009, SUPPORT DE COURS WINDOWS,,, CENATRIN CENTRE NATIONAL DE TRAITEMENT DE L'INFORMATION, SD, 36 P, TECHNOLOGIE FORMATION INFORMATIQUE WINDOWS,,
 TEC.0010,,,,, 2005, 48 P, STAGE ETUDE FORMATION COMPTABILITE GESTION STOCK FINANCE,,
 ETU.0024, RAPPORT DE STAGE, KYENDREBEOGO Esther, STAGE EFFECTUE DU 13 SEPTEMBRE AU 22 OCTOBRE 1993," KYENDREBEOGO, Esther", 1993, 33 P, STAGE ETUDE FORMATION,,
 ETU.0025,," HIEN, Lydie Viviane", STAGE EFFECTUE DU 9 JUILLET AU 9 SEPTEMBRE 1998, ATOS, 1995, 125 P, TECHNOLOGIE INFORMATIQUE FORMATION,,
 TEC.0011, SCHEMAS DIRECTEUR INFORMATIQUE SONABHY,,, TIME INFORMATIQUE, FEVRIER 1994 ET AVRIL 1994, 208 P, TECHNOLOGIE INFORMATIQUE SCHEMAS DIRECTEUR SONABHY,,
 TEC.0012, PROJET DE DYNAMISATION DU SERVICE INFORMATIQUE,,, SERVICE INFORMATIQUE SONABHY, 2001, 48 P, SONABHY PROJET INFORMATIQUE,,
 TEC.0013, ANALYSE FONCTIONNELLE GESTION DES STOCKS D'HYDROCARBURES,,, METSYS, SD, MULT PAG, INFORMATIQUE TECHNOLOGIE GESTION STOCKS,,
 TEC.0014,," Christian, PESSEY Georges, BASTENAIRE Yves, LEPECQ", LAROUSSE,, SD, MULT PAG, AUTOMOBILE MECANIQUE VEHICULE,,
 TEC.0015," NOTICE D'INSTRUCTONS ""VEHICULE EAU MOUSSE POUDRE SUR CHASSI MERCEDES ACTROS 2031"" TRI EXT 6000 - BURKINA FASO",,, GIMAEX, SD, MULT PAG, CAMION INCENDIE INCENDIE SECURITE CATALOGUE TECHNIQUE VEHICULE EAU MOUSSE VEHICULE MERCEDES,,
 TEC.0016, CALCULATEUR INDICATEUR ELECTRONIQUE SAPHIR,, NOTICE DE CONFIGURATION, TOCKHEIM SOFITAM APPLICATIONS, 2002, 19 P, SAPHIR TECHNOLOGIE TECHNIQUE CALCULATEUR COMPTEUR,,
 TEC.0017, CALCULATEUR INDICATEUR ELECTRONIQUE SAPHIR, TOCKHEIM SOFITAM APPLICATIONS SATAM, NOTICE D'UTILISATION, TOCKHEIM SOFITAM APPLICATIONS, 2002, 19 P, COMPTEUR TECHNOLOGIE TECHNIQUE CALCULATEUR SAPHIR,,
 TEC.0018, CALCULATEUR INDICATEUR ELECTRONIQUE SAPHIR, TOCKHEIM SOFITAM APPLICATIONS SATAM, NOTICE DE CALIBRATION, TOKHEIM SOFITAM APPLICATIONS, 2002, 11 P, CALCULATEUR SAPHIR TECHNOLOGIE TECHNIQUE COMPTEUR,,
 TEC.0019, RAPPORT D'ETALONNAGE ; INSTRUCTIONS COMPLEMENTAIRES POUR LES EQUIPEMENTS SOUMIS A LA DIRECTIVE ATEX 94/9/CE,, DECLARATION DE COMFORMITE CE, TOKHEIM SOFITAM APPLICATIONS, 2004, MULT PAG, COMPTEUR SAPHIR TECHNOLOGIE TECHNIQUE CALCULATEUR ETALONNAGE,,
 TEC.0020, REVUE ABB 3/2004,,, ABB, 2004, 71 p, TECHNOLOGIE ELECTRICITE TRANSFORMATEUR DISJONCTEUR,,
 ETU.0045, RAPPORT DE STAGE DE FIN DE CYCLE," SOUNTOURA, Solange", STAGE EFFECTUE DU 01 MAI AU 01 JUILLET 2005, SOUNTOURA Solange ; UNIVERSITE POLYTECHNIQUE DE BOBO (UPB) ; IUT, 2005, 58 p + ANNEXES, STAGE ETUDE FORMATION FACTURATION COMMERCE PRODUIT PETROLIER VENTE FACTURATION,,
 ETU.0046, RAPPORT DE FIN DE CYCLE," ILBOUDO, Bowendsom Marguerite", STAGE EFFECTUE DU 03 AVRIL AY 31 MAI 2006, ILBOUDO Bowendson Marguerite ; UNIVERSITE POLYTECHNIQUE DE BOBO (UPB) ; IUT, 2006, 38 P + ANNEXES, STAGE ETUDE FORMATION GESTION COMMERCE PRIX PRODUIT PETROLIER POLITIQUE HYDROCARBURE COMPTABILITE,,
 ETU.0047, RAPPORT DE STAGE DE FIN DE CYCLE," TRAORE NEE COULIBALY, G. Irène", STAGE EFFECTUE DU 01 SEPTEMBRE AU 31 NOVEMBRE 2006," TRAORE NEE COULIBALY, G. Irène INSTITUT SUPERIEUR DE L'INFORMATIQUE ET DE GESTION (ISIG) BOBO", 2006, 54 P + ANNEXES, STAGE FORMATION ETUDE GESTION COMPTABILITE MARKETING GESTION COMMERCIALE CLIENTELE COMMERCE,,
 ETU.0048, RAPPORT DE STAGE," BAMOUNI, Drissa Laurent", STAGE EFFECTUE DU 02 AU 31 JUILLET 2007, BAMOUNI Drissa Laurent ; UNIVERSITE CATHOLIQUE DE L'AFRIQUE DE L'OUEST (UCAO) ; UNITE UNIVERSITAIRE DE BOBO-DSSO (UUB), 2007, 27 P, FORMATION STAGE ETUDE MANAGEMENT MARKETING GESTION,,
 ETU.0049, Rapport de stage," KPODA, T. Bienvenue", Stage effectué du 16 Juillet au 16 Août 2007," KPODA, T. Bienvenue", 2007, 24 P, Stage Formation PROFESSION Etude Marketing Gestion Marketing Management,,
 ETU.0050, RAPPORT DE STAGE DE FIN DE CYCLE," OUEDRAOGO, B. Wilfried", STAGE EFFECTUE DU 03 SEPTEMBRE AU 02 NOVEMBRE 2007, INSTITUT SUPERIEUR DE L'INFORMATIQUE ET DE GESTION (ISIG) OUEDRAOGO B. Wilfried, 2007, 59 P, FORMATION STAGE ETUDE MANAGEMENT MARKETING GESTION COMMERCIALE CLIENTELE GESTION CLIENT PORTE FEUILLE CLIENT COMMERCE,,
 ETU.0051,," SARA, Cyrille", STAGE EFFECTUE DU 11 FEVRIER AU 10 AVRIL 2008," LYCEE PROFESSIONNEL DE BOBO (LPB) ; SARA, Cyrille",, 46 P, STAGE ETUDE FORMATION GESTION GESTION DES STOCKS COMPTABILITE COMMERCE,,
 ETU.0052, RAPPORT DE STAGE DE FIN DE CYCLE," BAKOALA, Pierre", STAGE EFFECTUE DU AU, UNIVERSITE POLYTECHNIQUE DE BOBO (UPB) ; INSTITUT UNIVERSITAIRE DE TECHNOLOGIE (IUT), 200.., 69 P + ANNEXES, GESTION ETUDE GESTION COMMERCIALE FORMATION STAGE DISTRIBUTION PRODUIT PRODUIT PETROLIER VENTE,,
 AMC.0040, TABLEAUX DE BORD ET BALANCED DE GESTION (ISIG)," MENDOZA, Carla DELMOND, Marie Hélène GIRAUD, Françoise LÖNING, Hélène DE FONT REAULX, Alexis",,, 1998, 41 P, STAGE ETUDE FORMATION SECRETARIAT,,
 ETU.0026,, OUATTARA Aoua Cécile, STAGE EFFECTUE DU 16 AOUT AU 16 OCTOBRE 2001," OUATTARA, Aoua Cécile INSTITUT UNIVERSITAIRE DE TECHNOLOGIE (IUT)", 2001, 43 P, STAGE ETUDE FORMATION SECRETARIAT TEMPS GESTION,,
 ETU.0027,, COULIBALY Alamako SCORECARDS,, GROUPE REVUE FIDUCIAIRE, 2005, 263 P, COMPTABILITE GESTION FISCALITE TABLEAU DE BORD CONTROLE DE GESTION BUDGET,,
 SEM.0001, INITIATION A L'UTILISATION DES,, HOTEL INDEPENDANCE OUAGADOUGOU DU 02 AU 04 MAI 1990, S N, 1990, 86 P, INFORMATIQUE MATERIEL INFORMATIQUE LOGICIEL ETUDE GESTION INFORMATIQUE,,
 SEM.0002, INFORMATIQUE ET TELECOMMUNICATIONS AU SERVICE DE LA GESTION,, HOTEL INDEPENDANCE OUAGADOUGOU DU 02 AU 04 MAI 1990, SN, 1990, 11 P, INFORMATIQUE TELECOMMUNICATION GESTION INFORMATIQUE,,
 SEM.0003, NECESSITE ET UTILITE DE L'INFORMATION DANS L'ENTREPRISE ; CONSEIL JURIDIQUE ET,, HOTEL INDEPENDANCE OUAGADOUGOU DU 02 AU 04 MAI 1990, SN, 1990, 52 P, INFORMATION ENTREPRISE FISCALITE CONSEIL JURIDIQUE GESTION COMMUNICATION,,
 SEM.0004, ASSEMBLEE GENERALE DES SOCIETES,,, MINISTERE DU COMMERCE DE L'INDUSTRIE ET DE L'ARTISANAT (MCIA), 1999, 13 P + ANNEXES, SOCIETE D'ETAT ASSEMBLEE GENERALE GESTION,,
 SEM.0005, SESSION DE FORMATION EN DROIT DU TRAVAIL AU PROFIT DES OUVRIERS ET AGENTS D'EXECUTION DE LA SONABHY,, SEMINAIRE DE FORMATION, CAJUFOR, 2004, 67 P, DROIT FORMATION DROIT DU TRAVAIL COMPORTEMENT CONTRAT DE TRAVAIL,,
 SEM.0006, RAPPORT DE LA SESSION DE FORMATION EN DROIT DU TRAVAIL AU PROFIT DES DELEGUES DU PERSONNEL DE LA SONABHY,,, CAJUFOR, 2004, 16 P, DROIT LEGISLATION DROIT DU TRAVAIL FORMATION,,
 ECO.0001, MANUEL DE DISTRIBUTION PHYSIQUE DES MARCHANDISES A L'EXPORTATION,, PREMIER VOLUME, CENTRE DU COMMERCE INTERNATIONAL, 1987, 137 P, ECONOMIE DISTRIBUTION EXPORTATION COMMERCE,,
 ECO.0002, MANUEL DE DISTRIBUTION PHYSIQUE DES MARCHANDISES A L'EXPORTATION,, DEUXIEME VOLUME, CENTRE DU COMMERCE INTERNATIONAL, 1988,, ECONOMIE COMMERCE EXPORTATION DISTRIBUTION,,
 ECO.0003, ELEMENTS DE L'ACTIVITE ECONOMIQUE EN HAUTE VOLTA 1980,, SERIE CONJONCTURE, INSTITUT NATIONAL DE LA STATISTIQUE ET DE LA DEMOGRAPHIE INSD, 1983, 29 P, ECONOMIE CONJONCTURE ACTIVITE, HAUTE VOLTA,
 ECO.0004, GUIDE DES OPERATIONS DE CREDIT DOCUMENTAIRE,, PUBLICATION N°305, ICC SERVICES, 1978, 49 P, ECONOMIE CREDIT CREDIT DOCUMENTAIRE FINANCE,,
 ECO.0005, LE PROGRAMME DE VERIFICATION DES IMPORTATIONS (PVI) AU BURKINA FASO,, GUIDE PRATIQUE POUR LES IMPORTATEURS, SOCIETE GENERALE DE SURVEILLANCE (SGS), 1992, 16 P + ANNEXES, ECONOMIE IMPORTATION VERIFICATION CONTROLE, BURKINA FASO,
 ECO.0006, PRINCIPES DIRECTEURS POUR LA MISE EN OEUVRE DU CADRE STRATEGIQUE DE LUTTE CONTRE LA PAUVRETE (CSLP),,, STC - PDES, 2004, 43 P, ECONOMIE CONJONCTURE,,
 ECO.0007,,, 4è EDITION A JOUR AU 1er DECEMBRE 1983, EDITION FRANCIS LEFEBVRE, 1984,, ECONOMIE CONCURRENCE CONSOMMATION,,
 ETU.0053, RAPPORT DE STAGE," TRAORE, Yé Aoua", EFFECTUE DU 1er SEPTEMBRE AU 31 OCTOBRE 2005," TRAORE, Yé Aoua", 2005, 80 P + ANNEXES, ETUDE STAGE FORMATION GESTION FINANCE COMPTABILITE,,
 ETU.0054, RAPPORT DE STAGE DE FIN DE CYCLE," COULIBALY , SAN APPOLINAIRE", STAGE EFFECTUE DU 03 OCTOBRE AU 02 DECEMBRE 2005," COULIBALY, SAN APPOLINAIRE", 2005, 59 P + ANNEXES, GESTION FINANCE COMPTABILITE IMMOBILISATION ETUDE FORMATION STAGE,,
 ETU.0055, RAPPORT DE STAGE DE FIN DE CYCLE," KABORE, Jacqueline", EFFECTUE DU 1er FEVRIER AU 31 MARS 2006," KABORE, Jacqueline", 2006, 82P + ANNEXES, GESTION COMPTABILITE STAGE ETUDE FORMATION IMMOBILISATION FINANCE,,
 ETU.0056, RAPPORT DE STAGE DE FIN DE CYCLE," DOMBOE, Seyndia Flaure Eveline", EFFECTUE DU 2 MAI AU 30 JUIN 2006," DOMBOE, Seyndia Flaure Eveline", 2006, 61P + ANNEXES, ETUDE GESTION STAGE FORMATION COMPTABILITE FINANCE E,,
 ETU.0057, LA PLACE DE LA SONABHY DANS LE TISSUS FISCAL BURKINABE," YAMEOGO, Assèta Arzoumpoko", EFFECTUE DU 02 MAI AU 30 JUIN 2006," YAMEOGO, Assèta Arzoumpoko", 2006, 84 P + ANNEXES, COMPTABILITE ETUDE FORMATION STAGE SONABHY ECONOMIE TISSUS FISCAL FISCALITE, BURKINA FASO,
 ETU.0058,," BITIE, Bidianwo Léontine", STAGE EFFECTUE DU 7 JUIN AU 6 AOUT 2004," COULIBALY, Alamako INSTITUT UNIVERSITAIRE DE TECHNOLOGIE (IUT)", 2004, 53 P, STAGE ETUDE FORMATION SECRETARIAT  POSTE DE TRAVAIL MANAGEMENT,,
 ETU.0028,, ZIDA Adiaratou, STAGE EFFECTUE DU 8 JUIN AU 11 AOUT 2004," ZIDA, Adiaratou INSTITUT UNIVERSITAIRE DE TECHNOLOGIE (IUT)", 2004, 55 P, STAGE ETUDE FORMATION SECRETARIAT CARRIERE,,
 ETU.0059,," BASSOLE, Hippolyte", EFFECTUE DU 1er NOVEMBRE AU 31 DECEMBRE 2006," BASSOLE, Hippolyte", 2006, 75 P + ANNEXES, STAGE FORMATION ETUDE COMPTABILITE FINANCE GESTION BUDGET,,
 ETU.0060,," ZONGO, V. Isidore", EFFECTUE DU 02 NOVEMBRE AU 30 DECEMBRE 2006," ZONGO, V. Isidore", 2006, 56 P ANNEXES, FORMATION STAGE ETUDE COMPTABILITE FINANCE ACTIVITE PROFESSIONNELLE,,
 ETU.0061,," TRAORE, Drissa", EFFECTUE DU 1er FEVRIER AU 31 MARS 2007," TRAORE, Drissa", 2007, 44 P + ANNEXES, STAGE ETUDE FORMATION COMPTABILITE ACTIVITE PROFESSIONNELLE,,
 ETU.0062,," TRAORE, Issouf", EFFECTUE DU 1er FEVRIER AU 31 MARS 2007," TRAORE, Issouf", 2007, 41 P + ANNEXES, COMPTABILITE STAGE FORMATION ETUDE ACTIVITE PROFESSIONNELLE,,
 ETU.0063,," SIGUE, Mamadi", EFFECTUE DU 18 FEVRIER AU 17 AVRIL 2008," SIGUE, Mamadi", 2008, 43 P + ANNEXES, COMPTABILITE STAGE FORMATION ETUDE ACTIVITE PROFESSIONNELLE,,
 ETU.0064,," TOU, Aïcha", EFFECTUE DU 18 FEVRIER AU 17 AVRIL 2008," TOU, Aïcha", 2006, 39 P + ANNEXES, COMPTABILITE ETUDE STAGE FORMATION ACTIVITE PROFESSIONNELLE,,
 ETU.0065,," TAMINI, Dominique", EFFECTUE DU 18 FEVRIER AU 18 AVRIL 2008 A LA SIFA," TAMINI, Dominique", 2008, 48 P + ANNEXES, COMPTABILITE STAGE FORMATION ETUDE ACTIVITE PROFESSIONNELLE,,
 ETU.0066,," SOME, Sévérin", EFFECTUE DU 18 FEVRIER AU 18 AVRIL 2008 A LA SONAR BOBO," SOME, Sévérin", 2008, 50 P + ANNEXES, COMPTABILITE ACTIVITE PROFESSIONNELLE FORMATION STAGE ETUDE,,
 IEC.0001, PROGRAMME NATIONAL DES SESSIONS DE FORMATION 2001,,, IGEMA AFRIQUE, 2001, 21 P, FORMATION IGEMA AFRIQUE,,
 IEC.0002, SECURITE INCENDIE - SECOURISME,, ORGANISE DU 07 AU 11 NOVEMBRE 2000, INSTITUT INDUSTRIEL DE L'AFRIQUE DE L'OUEST (IIAO), 2000, Mult. Pag, INCENDIE SECURITE SECOURISME,, FORMATION SUIVIE PAR MONSIEUR BASSOLE Hippolyte
 IEC.0003, CONCEPTION - EXPLOITATION ET MAINTENANCE DU MATERIEL DANS LES DEPOTS PETROLIERS,, ORGANISE DU 10 AU 27 JUIN 2003, ENSPM, 2003, Mult Pag, DEPOT PETROLIER EXPLOITATION MAINTENANCE MATERIEL FORMATION TUYAUTERIE,,
 IEC.0004,,,, SHELL INTERNATIONAL PETROLEUM COMPANY LIMITED, 1980, Mult Pag, EXPLOITATION DEPOT SECURITE MANUEL DIDACTIQUE,,
 IEC.0005, STAGE DE FORMATION 2001,,, ENSPM, 2000, 236 P, STAGE FORMATION PETROLE MOTEUR,,
 IEC.0006, CATALOGUE DES FORMATIONS,, EDITION 1998-2000, IIAO, 1997, Mult Pag, FORMATION CATALOGUE PERFECTIONNEMENT ASSISTANCE EXPERTISE TECHNIQUE,,
 IEC.0007, ECONOMIE ET GESTION,, STAGE DE FORMATION 1999, ENSPM, 1998, 32 P, ECONOMIE FORMATION GESTION STAGE PETROLE MOTEUR,,
 IEC.0008, NOTICE D'UTILISATION ET D'ENTRETIEN SONDE DE NIVEAU ET TEMPERATURE PORTATIVE TYPE 1215,,, WHESSOE, 1986, Mult Pag, SONDE DE NIVEAU NOTICE D'UTILISATION MANUEL SONDE PORTATIVE SONDE DE TEMPERATURE SONDE TYPE 1215,,
 IEC.0009, SEMINAIRE DE SENSIBILISATION SUR LA,,, MINISTERE DES TRANSPORTS ET DU TOURISME (MTT), 2000, 36 P, SECURITE INCENDIE SECURITE VEHICULE CITERNE CAMION CITERNE FORMATION SECURITE ROUTIERE,,
 IEC.0010, SEMINAIRE DE FORMATION DU 08 AU 10 DECEMBRE 1999,,, CNSS, 1999, Mult. Pag, FORMATION CONVENTION SECURITE SOCIALE PRESTATION FAMILIALE ACCIDENT DE TRAVAIL MALADIE PROFESSIONNELLE SANTE MATERNELLE ASSURANCE,,
 IEC.0011, DIAGNOSTIC DES RISQUES EN ENTREPRISE ;,,,,,,,,
 ETU.0029, RAPPORT DE STAGE DE FIN DE CYCLE, GUIAO Rahamata, STAGE EFFECTUE DU 17 AOUT AU 17 OCTOBRE 2004," GUIAO, Rahamata INSTITUT UNIVERSITAIRE DE TECHNOLOGIE (IUT)", 2004, 50 P, STAGE ETUDE FORMATION SECRETARIAT SECRETAIRE AMBASSADRICE,,
 ETU.0030,, BASSOLE Béatrice, 4 MODULES, USTEF ; ESPACE MEDICAL EMMAÜS, SD, Mult Pag, FORMATION MEDECINE DU TRAVAIL ACCIDENT DE TRAVAIL SANTE RISQUE PROFESSIONNEL,,
 IEC.0012, CONCEPTION DES LIEUX ET DES SITUATIONS DE TRAVAIL,,, inrs, 2006, 149 P, LIEU DE TRAVAIL CADRE DE TRAVAIL SITUATION DE TRAVAIL POSTE DE TRAVAIL SANTE SECURITE RISQUE PROFESSIONNEL,,
 AMC.0041, PRECIS DE COMPTABILITE GENERALE," BERNARD DANSOU, GOVOEI", DROIT ET SYSTEME COMPTABLES OHADA. CONTRIBUTION A L'AMELIORATION ET A LA VULGARISATION DU SYSTEME VERS LES NORMES COMPTABLES INTERNATIONALES IAS/IFRS, ETUDIS,, 863 P, COMPTABILITE GENERALE COMPTABILITE PRECIS DE COMPTABILITE OHADA SYSTEME COMPTABLE OHADA DROIT ET SYSTEME COMPTABLE,,
